Poster_Link,Series_Title,Overview
"https://m.media-amazon.com/images/M/MV5BOTIzZGU4ZWMtYmNjMy00NzU0LTljMGYtZmVkMDYwN2U2MzYwL2ltYWdlXkEyXkFqcGdeQXVyNTAyODkwOQ@@._V1_UX67_CR0,0,67,98_AL_.jpg",Lat sau san taam,A tough-as-nails cop teams up with an undercover agent to shut down a sinister mobster and his crew.
"https://m.media-amazon.com/images/M/MV5BOGNmMjBmZWEtOWYwZC00NGIzLTg0YWItMzkzMWMwOTU4YTViXkEyXkFqcGdeQXVyNzc5MjA3OA@@._V1_UX67_CR0,0,67,98_AL_.jpg",Night on Earth,An anthology of 5 different cab drivers in 5 American and European cities and their remarkable fares on the same eventful night.
"https://m.media-amazon.com/images/M/MV5BYmE0ZGRiMDgtOTU0ZS00YWUwLTk5YWQtMzhiZGVhNzViMGZiXkEyXkFqcGdeQXVyMTMxODk2OTU@._V1_UX67_CR0,0,67,98_AL_.jpg",La double vie de Véronique,"Two parallel stories about two identical women; one living in Poland, the other in France. They don't know each other, but their lives are nevertheless profoundly connected."
"https://m.media-amazon.com/images/M/MV5BZmRjNDI5NTgtOTIwMC00MzJhLWI4ZTYtMmU0ZTE3ZmRkZDNhXkEyXkFqcGdeQXVyMTQxNzMzNDI@._V1_UX67_CR0,0,67,98_AL_.jpg",Boyz n the Hood,"Follows the lives of three young males living in the Crenshaw ghetto of Los Angeles, dissecting questions of race, relationships, violence, and future prospects."
"https://m.media-amazon.com/images/M/MV5BNzY0ODQ3MTMxN15BMl5BanBnXkFtZTgwMDkwNTg4NjE@._V1_UX67_CR0,0,67,98_AL_.jpg",Misery,"After a famous author is rescued from a car crash by a fan of his novels, he comes to realize that the care he is receiving is only the beginning of a nightmare of captivity and abuse."
"https://m.media-amazon.com/images/M/MV5BMjI5NjEzMDYyMl5BMl5BanBnXkFtZTgwNjgwNTg4NjE@._V1_UY98_CR3,0,67,98_AL_.jpg",Awakenings,"The victims of an encephalitis epidemic many years ago have been catatonic ever since, but now a new drug offers the prospect of reviving them."
"https://m.media-amazon.com/images/M/MV5BOTc0ODM1Njk1NF5BMl5BanBnXkFtZTcwMDI5OTEyNw@@._V1_UY98_CR1,0,67,98_AL_.jpg",Majo no takkyûbin,"A young witch, on her mandatory year of independent life, finds fitting into a new community difficult while she supports herself by running an air courier service."
"https://m.media-amazon.com/images/M/MV5BODhlNjA5MDEtZDVhNS00ZmM3LTg1YzAtZGRjNjhjNTAzNzVkXkEyXkFqcGdeQXVyNjUwMzI2NzU@._V1_UY98_CR0,0,67,98_AL_.jpg",Glory,"Robert Gould Shaw leads the U.S. Civil War's first all-black volunteer company, fighting prejudices from both his own Union Army, and the Confederates."
"https://m.media-amazon.com/images/M/MV5BMDQyMDVhZjItMGI0Mi00MDQ1LTk3NmQtZmRjZGQ5ZTQ2ZDU5XkEyXkFqcGdeQXVyNTAyODkwOQ@@._V1_UX67_CR0,0,67,98_AL_.jpg",Dip huet seung hung,A disillusioned assassin accepts one last hit in hopes of using his earnings to restore vision to a singer he accidentally blinded.
"https://m.media-amazon.com/images/M/MV5BZTMxMGM5MjItNDJhNy00MWI2LWJlZWMtOWFhMjI5ZTQwMWM3XkEyXkFqcGdeQXVyMTQxNzMzNDI@._V1_UX67_CR0,0,67,98_AL_.jpg",Back to the Future Part II,"After visiting 2015, Marty McFly must repeat his visit to 1955 to prevent disastrous changes to 1985...without interfering with his first trip."
"https://m.media-amazon.com/images/M/MV5BZTFjNjU4OTktYzljMS00MmFlLWI3NGEtNjNhMTYwYzUyZDgyL2ltYWdlL2ltYWdlXkEyXkFqcGdeQXVyNjU0OTQ0OTY@._V1_UX67_CR0,0,67,98_AL_.jpg",Mississippi Burning,Two F.B.I. Agents with wildly different styles arrive in Mississippi to investigate the disappearance of some civil rights activists.
"https://m.media-amazon.com/images/M/MV5BY2QwYmFmZTEtNzY2Mi00ZWMyLWEwY2YtMGIyNGZjMWExOWEyXkEyXkFqcGdeQXVyNjUwNzk3NDc@._V1_UX67_CR0,0,67,98_AL_.jpg",Predator,A team of commandos on a mission in a Central American jungle find themselves hunted by an extraterrestrial warrior.
"https://m.media-amazon.com/images/M/MV5BMWY3ODZlOGMtNzJmOS00ZTNjLWI3ZWEtZTJhZTk5NDZjYWRjXkEyXkFqcGdeQXVyNjU0OTQ0OTY@._V1_UX67_CR0,0,67,98_AL_.jpg",Evil Dead II,The lone survivor of an onslaught of flesh-possessing spirits holes up in a cabin with a group of strangers while the demons continue their attack.
"https://m.media-amazon.com/images/M/MV5BMDA0NjZhZWUtNmI2NC00MmFjLTgwZDYtYzVjZmNhMDVmOTBkXkEyXkFqcGdeQXVyMTQxNzMzNDI@._V1_UX67_CR0,0,67,98_AL_.jpg",Ferris Bueller's Day Off,"A high school wise guy is determined to have a day off from school, despite what the Principal thinks of that."
"https://m.media-amazon.com/images/M/MV5BM2ZmNDJiZTUtYjg5Zi00M2I3LTliZjAtNzQ4NTlkYTAzYTAxXkEyXkFqcGdeQXVyNTkyMDc0MjI@._V1_UX67_CR0,0,67,98_AL_.jpg",Down by Law,"Two men are framed and sent to jail, where they meet a murderer who helps them escape and leave the state."
"https://m.media-amazon.com/images/M/MV5BODRlMjRkZGEtZWM2Zi00ZjYxLWE0MWUtMmM1YWM2NzZlOTE1XkEyXkFqcGdeQXVyMTQxNzMzNDI@._V1_UX67_CR0,0,67,98_AL_.jpg",The Goonies,A group of young misfits called The Goonies discover an ancient map and set out on an adventure to find a legendary pirate's long-lost treasure.
"https://m.media-amazon.com/images/M/MV5BZDRkOWQ5NGUtYTVmOS00ZjNhLWEwODgtOGI2MmUxNTBkMjU0XkEyXkFqcGdeQXVyMjUzOTY1NTc@._V1_UX67_CR0,0,67,98_AL_.jpg",The Color Purple,A black Southern woman struggles to find her identity after suffering abuse from her father and others over four decades.
"https://m.media-amazon.com/images/M/MV5BOTM5N2ZmZTMtNjlmOS00YzlkLTk3YjEtNTU1ZmQ5OTdhODZhXkEyXkFqcGdeQXVyMTQxNzMzNDI@._V1_UX67_CR0,0,67,98_AL_.jpg",The Breakfast Club,Five high school students meet in Saturday detention and discover how they have a lot more in common than they thought.
"https://m.media-amazon.com/images/M/MV5BMGI0NzI5YjAtNTg0MS00NDA2LWE5ZWItODRmOTAxOTAxYjg2L2ltYWdlL2ltYWdlXkEyXkFqcGdeQXVyNTI4MjkwNjA@._V1_UX67_CR0,0,67,98_AL_.jpg",The Killing Fields,"A journalist is trapped in Cambodia during tyrant Pol Pot's bloody 'Year Zero' cleansing campaign, which claimed the lives of two million 'undesirable' civilians."
"https://m.media-amazon.com/images/M/MV5BMTkxMjYyNzgwMl5BMl5BanBnXkFtZTgwMTE3MjYyMTE@._V1_UX67_CR0,0,67,98_AL_.jpg",Ghostbusters,Three former parapsychology professors set up shop as a unique ghost removal service.
"https://m.media-amazon.com/images/M/MV5BOTUwMDA3MTYtZjhjMi00ODFmLTg5ZTAtYzgwN2NlODgzMmUwXkEyXkFqcGdeQXVyNjc1NTYyMjg@._V1_UX67_CR0,0,67,98_AL_.jpg",The Right Stuff,"The story of the original Mercury 7 astronauts and their macho, seat-of-the-pants approach to the space program."
"https://m.media-amazon.com/images/M/MV5BMTViNjlkYjgtMmE3Zi00ZGVkLTkyMjMtNzc3YzAwNzNiODQ1XkEyXkFqcGdeQXVyMjA0MzYwMDY@._V1_UX67_CR0,0,67,98_AL_.jpg",The King of Comedy,"Rupert Pupkin is a passionate yet unsuccessful comic who craves nothing more than to be in the spotlight and to achieve this, he stalks and kidnaps his idol to take the spotlight for himself."
"https://m.media-amazon.com/images/M/MV5BMTQ2ODFlMDAtNzdhOC00ZDYzLWE3YTMtNDU4ZGFmZmJmYTczXkEyXkFqcGdeQXVyMTQxNzMzNDI@._V1_UX67_CR0,0,67,98_AL_.jpg",E.T. the Extra-Terrestrial,A troubled child summons the courage to help a friendly alien escape Earth and return to his home world.
"https://m.media-amazon.com/images/M/MV5BNDM3YjNlYmMtOGY3NS00MmRjLWIyY2UtNDA0MWM3OTNlZTY2XkEyXkFqcGdeQXVyMTQxNzMzNDI@._V1_UX67_CR0,0,67,98_AL_.jpg",Kramer vs. Kramer,"Ted Kramer's wife leaves him, allowing for a lost bond to be rediscovered between Ted and his son, Billy. But a heated custody battle ensues over the divorced couple's son, deepening the wounds left by the separation."
"https://m.media-amazon.com/images/M/MV5BZjMyZmU4OGYtNjBiYS00YTIxLWJjMDUtZjczZmQwMTM4YjQxXkEyXkFqcGdeQXVyNTI4MjkwNjA@._V1_UX67_CR0,0,67,98_AL_.jpg",Days of Heaven,A hot-tempered farm laborer convinces the woman he loves to marry their rich but dying boss so that they can have a claim to his fortune.
"https://m.media-amazon.com/images/M/MV5BMjIxNDYxMTk2MF5BMl5BanBnXkFtZTgwMjQxNjU3MTE@._V1_UY98_CR0,0,67,98_AL_.jpg",The Outlaw Josey Wales,Missouri farmer Josey Wales joins a Confederate guerrilla unit and winds up on the run from the Union soldiers who murdered his family.
"https://m.media-amazon.com/images/M/MV5BZWQzYjBjZmQtZDFiOS00ZDQ1LWI4MDAtMDk1NGE1NDBhYjNhL2ltYWdlXkEyXkFqcGdeQXVyNjc1NTYyMjg@._V1_UX67_CR0,0,67,98_AL_.jpg",The Man Who Would Be King,"Two British former soldiers decide to set themselves up as Kings in Kafiristan, a land where no white man has set foot since Alexander the Great."
"https://m.media-amazon.com/images/M/MV5BNzZlMThlYzktMDlmZC00YTI1LThlNzktZWU0MTY4ODc2ZWY4XkEyXkFqcGdeQXVyNTA1NjYyMDk@._V1_UX67_CR0,0,67,98_AL_.jpg",The Conversation,"A paranoid, secretive surveillance expert has a crisis of conscience when he suspects that the couple he is spying on will be murdered."
"https://m.media-amazon.com/images/M/MV5BYjhhMDFlZDctYzg1Mi00ZmZiLTgyNTgtM2NkMjRkNzYwZmQ0XkEyXkFqcGdeQXVyMTMxODk2OTU@._V1_UX67_CR0,0,67,98_AL_.jpg",La planète sauvage,"On a faraway planet where blue giants rule, oppressed humanoids rebel against their machine-like leaders."
"https://m.media-amazon.com/images/M/MV5BNjZmMWE4NzgtZjc5OS00NTBmLThlY2MtM2MzNTA5NTZiNTFjXkEyXkFqcGdeQXVyNjc1NTYyMjg@._V1_UY98_CR0,0,67,98_AL_.jpg",The Day of the Jackal,"A professional assassin codenamed ""Jackal"" plots to kill Charles de Gaulle, the President of France."
"https://m.media-amazon.com/images/M/MV5BMDcxNjhiOTEtMzQ0YS00OTBhLTkxM2QtN2UyZDMzNzIzNWFlXkEyXkFqcGdeQXVyMTQxNzMzNDI@._V1_UY98_CR1,0,67,98_AL_.jpg",Badlands,An impressionable teenage girl from a dead-end town and her older greaser boyfriend embark on a killing spree in the South Dakota badlands.
"https://m.media-amazon.com/images/M/MV5BNTEyMzc0Mjk5MV5BMl5BanBnXkFtZTgwMjI2NDIwMTE@._V1_UX67_CR0,0,67,98_AL_.jpg",Cabaret,A female girlie club entertainer in Weimar Republic era Berlin romances two men while the Nazi Party rises to power around them.
"https://m.media-amazon.com/images/M/MV5BZTllNDU0ZTItYTYxMC00OTI4LThlNDAtZjNiNzdhMWZiYjNmXkEyXkFqcGdeQXVyNzY1NDgwNjQ@._V1_UX67_CR0,0,67,98_AL_.jpg",Willy Wonka & the Chocolate Factory,A poor but hopeful boy seeks one of the five coveted golden tickets that will send him on a tour of Willy Wonka's mysterious chocolate factory.
"https://m.media-amazon.com/images/M/MV5BNTgwZmIzMmYtZjE3Yy00NzgzLTgxNmUtNjlmZDlkMzlhOTJkXkEyXkFqcGdeQXVyNjUwNzk3NDc@._V1_UX67_CR0,0,67,98_AL_.jpg",Midnight Cowboy,"A naive hustler travels from Texas to New York City to seek personal fortune, finding a new friend in the process."
"https://m.media-amazon.com/images/M/MV5BMTQyNTAzOTI3NF5BMl5BanBnXkFtZTcwNTM0Mjg0Mg@@._V1_UX67_CR0,0,67,98_AL_.jpg",Wait Until Dark,A recently blinded woman is terrorized by a trio of thugs while they search for a heroin-stuffed doll they believe is in her apartment.
"https://m.media-amazon.com/images/M/MV5BZTVmMTk2NjUtNjVjNC00OTcwLWE4OWEtNzA4Mjk1ZmIwNDExXkEyXkFqcGdeQXVyNjUwNzk3NDc@._V1_UX67_CR0,0,67,98_AL_.jpg",Guess Who's Coming to Dinner,A couple's attitudes are challenged when their daughter introduces them to her African-American fiancé.
"https://m.media-amazon.com/images/M/MV5BOTViZmMwOGEtYzc4Yy00ZGQ1LWFkZDQtMDljNGZlMjAxMjhiXkEyXkFqcGdeQXVyNzM0MTUwNTY@._V1_UX67_CR0,0,67,98_AL_.jpg",Bonnie and Clyde,"Bored waitress Bonnie Parker falls in love with an ex-con named Clyde Barrow and together they start a violent crime spree through the country, stealing cars and robbing banks."
"https://m.media-amazon.com/images/M/MV5BNGM0ZTU3NmItZmRmMy00YWNjLWEzMWItYzg3MzcwZmM5NjdiXkEyXkFqcGdeQXVyNDYyMDk5MTU@._V1_UY98_CR2,0,67,98_AL_.jpg",My Fair Lady,Snobbish phonetics Professor Henry Higgins agrees to a wager that he can make flower girl Eliza Doolittle presentable in high society.
"https://m.media-amazon.com/images/M/MV5BNmJkODczNjItNDI5Yy00MGI1LTkyOWItZDNmNjM4ZGI1ZDVlL2ltYWdlL2ltYWdlXkEyXkFqcGdeQXVyMDI2NDg0NQ@@._V1_UX67_CR0,0,67,98_AL_.jpg",Mary Poppins,"In turn of the century London, a magical nanny employs music and adventure to help two neglected children become closer to their father."
"https://m.media-amazon.com/images/M/MV5BZTM1ZjQ2YTktNDM2MS00NGY2LTkzNzItZTU4ODg1ODNkMWYxL2ltYWdlXkEyXkFqcGdeQXVyNjc1NTYyMjg@._V1_UX67_CR0,0,67,98_AL_.jpg",The Longest Day,"The events of D-Day, told on a grand scale from both the Allied and German points of view."
"https://m.media-amazon.com/images/M/MV5BZTM1MTRiNDctMTFiMC00NGM1LTkyMWQtNTY1M2JjZDczOWQ3XkEyXkFqcGdeQXVyMDI3OTIzOA@@._V1_UY98_CR3,0,67,98_AL_.jpg",Jules et Jim,Decades of a love triangle concerning two friends and an impulsive woman.
"https://m.media-amazon.com/images/M/MV5BNGQyNjBjNTUtNTM1OS00YzcyLWFhNTgtNTU0MDg3NzBlMDQzXkEyXkFqcGdeQXVyNjc1NTYyMjg@._V1_UY98_CR0,0,67,98_AL_.jpg",The Innocents,A young governess for two children becomes convinced that the house and grounds are haunted.
"https://m.media-amazon.com/images/M/MV5BNzk5MDk2MjktY2I3NS00ODZkLTk3OTktY2Q3ZDE2MmQ2M2ZmXkEyXkFqcGdeQXVyNjc1NTYyMjg@._V1_UY98_CR2,0,67,98_AL_.jpg",À bout de souffle,"A small-time thief steals a car and impulsively murders a motorcycle policeman. Wanted by the authorities, he reunites with a hip American journalism student and attempts to persuade her to run away with him to Italy."
"https://m.media-amazon.com/images/M/MV5BNzNiOGJhMDUtZjNjMC00YmE5LTk3NjQtNGM4ZjAzOGJjZmRlXkEyXkFqcGdeQXVyNjc1NTYyMjg@._V1_UX67_CR0,0,67,98_AL_.jpg",Red River,"Dunson leads a cattle drive, the culmination of over 14 years of work, to its destination in Missouri. But his tyrannical behavior along the way causes a mutiny, led by his adopted son."
"https://m.media-amazon.com/images/M/MV5BODI3YzNiZTUtYjEyZS00ODkwLWE2ZDUtNGJmMTNiYTc4ZTM4XkEyXkFqcGdeQXVyMDI2NDg0NQ@@._V1_UX67_CR0,0,67,98_AL_.jpg",Key Largo,"A man visits his war buddy's family hotel and finds a gangster running things. As a hurricane approaches, the two end up confronting each other."
"https://m.media-amazon.com/images/M/MV5BZGU2YmU0MWMtMzg5My00ZmY2LTljMDItMTg2YTI5Y2U2OTE3XkEyXkFqcGdeQXVyMjUxODE0MDY@._V1_UY98_CR0,0,67,98_AL_.jpg",To Have and Have Not,"During World War II, American expatriate Harry Morgan helps transport a French Resistance leader and his beautiful wife to Martinique while romancing a sensuous lounge singer."
"https://m.media-amazon.com/images/M/MV5BM2I1YWM4NTYtYjA0Ny00ZDEwLTg3NTgtNzBjMzZhZTk1YTA1XkEyXkFqcGdeQXVyMTY5Nzc4MDY@._V1_UX67_CR0,0,67,98_AL_.jpg",Shadow of a Doubt,"A young girl, overjoyed when her favorite uncle comes to visit the family, slowly begins to suspect that he is in fact the ""Merry Widow"" killer sought by the authorities."
"https://m.media-amazon.com/images/M/MV5BOGQ4NDUyNWQtZTEyOC00OTMzLWFhYjAtNDNmYmQ2MWQyMTRmXkEyXkFqcGdeQXVyNTA4NzY1MzY@._V1_UX67_CR0,0,67,98_AL_.jpg",Stagecoach,A group of people traveling on a stagecoach find their journey complicated by the threat of Geronimo and learn something about each other in the process.
"https://m.media-amazon.com/images/M/MV5BNjk3YzFjYTktOGY0ZS00Y2EwLTk2NTctYTI1Nzc2OWNiN2I4XkEyXkFqcGdeQXVyNzM0MTUwNTY@._V1_UX67_CR0,0,67,98_AL_.jpg",The Lady Vanishes,"While travelling in continental Europe, a rich young playgirl realizes that an elderly lady seems to have disappeared from the train."
"https://m.media-amazon.com/images/M/MV5BMmVkOTRiYmItZjE4NS00MWNjLWE0ZmMtYzg5YzFjMjMyY2RkXkEyXkFqcGdeQXVyNjc1NTYyMjg@._V1_UX67_CR0,0,67,98_AL_.jpg",Bringing Up Baby,"While trying to secure a $1 million donation for his museum, a befuddled paleontologist is pursued by a flighty and often irritating heiress and her pet leopard, Baby."
"https://m.media-amazon.com/images/M/MV5BOTUzMzAzMzEzNV5BMl5BanBnXkFtZTgwOTg1NTAwMjE@._V1_UX67_CR0,0,67,98_AL_.jpg",Bride of Frankenstein,"Mary Shelley reveals the main characters of her novel survived: Dr. Frankenstein, goaded by an even madder scientist, builds his monster a mate."
"https://m.media-amazon.com/images/M/MV5BYmYxZGU2NWYtNzQxZS00NmEyLWIzN2YtMDk5MWM0ODc5ZTE4XkEyXkFqcGdeQXVyNTA4NzY1MzY@._V1_UX67_CR0,0,67,98_AL_.jpg",Duck Soup,Rufus T. Firefly is named president/dictator of bankrupt Freedonia and declares war on neighboring Sylvania over the love of wealthy Mrs. Teasdale.
"https://m.media-amazon.com/images/M/MV5BYmMxZTU2ZDUtM2Y1MS00ZWFmLWJlN2UtNzI0OTJiOTYzMTk3XkEyXkFqcGdeQXVyMjUxODE0MDY@._V1_UX67_CR0,0,67,98_AL_.jpg",Scarface: The Shame of the Nation,"An ambitious and nearly insane violent gangster climbs the ladder of success in the mob, but his weaknesses prove to be his downfall."
"https://m.media-amazon.com/images/M/MV5BMTQ0Njc1MjM0OF5BMl5BanBnXkFtZTgwNTY2NTUyMjE@._V1_UX67_CR0,0,67,98_AL_.jpg",Frankenstein,Dr. Frankenstein dares to tamper with life and death by creating a human monster out of lifeless body parts.
"https://m.media-amazon.com/images/M/MV5BMTU0OTc3ODk4Ml5BMl5BanBnXkFtZTgwMzM4NzI5NjM@._V1_UX67_CR0,0,67,98_AL_.jpg",Roma,A year in the life of a middle-class family's maid in Mexico City in the early 1970s.
"https://m.media-amazon.com/images/M/MV5BNjRhYzk2NDAtYzA1Mi00MmNmLWE1ZjQtMDBhZmUyMTdjZjBiXkEyXkFqcGdeQXVyNjk1Njg5NTA@._V1_UX67_CR0,0,67,98_AL_.jpg",God's Own Country,"Spring. Yorkshire. Young farmer Johnny Saxby numbs his daily frustrations with binge drinking and casual sex, until the arrival of a Romanian migrant worker for lambing season ignites an intense relationship that sets Johnny on a new path."
"https://m.media-amazon.com/images/M/MV5BNjk1Njk3YjctMmMyYS00Y2I4LThhMzktN2U0MTMyZTFlYWQ5XkEyXkFqcGdeQXVyODM2ODEzMDA@._V1_UY98_CR15,0,67,98_AL_.jpg",Deadpool 2,"Foul-mouthed mutant mercenary Wade Wilson (a.k.a. Deadpool), brings together a team of fellow mutant rogues to protect a young boy with supernatural abilities from the brutal, time-traveling cyborg Cable."
"https://m.media-amazon.com/images/M/MV5BMTUyMjU1OTUwM15BMl5BanBnXkFtZTgwMDg1NDQ2MjI@._V1_UX67_CR0,0,67,98_AL_.jpg",Wind River,A veteran hunter helps an FBI agent investigate the murder of a young woman on a Wyoming Native American reservation.
"https://m.media-amazon.com/images/M/MV5BMjUxMDQwNjcyNl5BMl5BanBnXkFtZTgwNzcwMzc0MTI@._V1_UX67_CR0,0,67,98_AL_.jpg",Get Out,"A young African-American visits his white girlfriend's parents for the weekend, where his simmering uneasiness about their reception of him eventually reaches a boiling point."
"https://m.media-amazon.com/images/M/MV5BNjRlZmM0ODktY2RjNS00ZDdjLWJhZGYtNDljNWZkMGM5MTg0XkEyXkFqcGdeQXVyNjAwMjI5MDk@._V1_UX67_CR0,0,67,98_AL_.jpg",Mission: Impossible - Fallout,"Ethan Hunt and his IMF team, along with some familiar allies, race against time after a mission gone wrong."
"https://m.media-amazon.com/images/M/MV5BMjE0NDUyOTc2MV5BMl5BanBnXkFtZTgwODk2NzU3OTE@._V1_UX67_CR0,0,67,98_AL_.jpg",En man som heter Ove,"Ove, an ill-tempered, isolated retiree who spends his days enforcing block association rules and visiting his wife's grave, has finally given up on life just as an unlikely friendship develops with his boisterous new neighbors."
"https://m.media-amazon.com/images/M/MV5BMjAwNDA5NzEwM15BMl5BanBnXkFtZTgwMTA1MDUyNDE@._V1_UX67_CR0,0,67,98_AL_.jpg",What We Do in the Shadows,"Viago, Deacon and Vladislav are vampires who are finding that modern life has them struggling with the mundane - like paying rent, keeping up with the chore wheel, trying to get into nightclubs and overcoming flatmate conflicts."
"https://m.media-amazon.com/images/M/MV5BZTlmYTJmMWEtNDRhNy00ODc1LTg2OTMtMjk2ODJhNTA4YTE1XkEyXkFqcGdeQXVyMTMxODk2OTU@._V1_UY98_CR0,0,67,98_AL_.jpg",Omoide no Mânî,"Due to 12 y.o. Anna's asthma, she's sent to stay with relatives of her guardian in the Japanese countryside. She likes to be alone, sketching. She befriends Marnie. Who is the mysterious, blonde Marnie."
"https://m.media-amazon.com/images/M/MV5BMTAwMTU4MDA3NDNeQTJeQWpwZ15BbWU4MDk4NTMxNTIx._V1_UX67_CR0,0,67,98_AL_.jpg",The Theory of Everything,A look at the relationship between the famous physicist Stephen Hawking and his wife.
"https://m.media-amazon.com/images/M/MV5BYTM3ZTllNzItNTNmOS00NzJiLTg1MWMtMjMxNDc0NmJhODU5XkEyXkFqcGdeQXVyODE5NzE3OTE@._V1_UX67_CR0,0,67,98_AL_.jpg",Kingsman: The Secret Service,"A spy organisation recruits a promising street kid into the agency's training program, while a global threat emerges from a twisted tech genius."
"https://m.media-amazon.com/images/M/MV5BNTVkMTFiZWItOTFkOC00YTc3LWFhYzQtZTg3NzAxZjJlNTAyXkEyXkFqcGdeQXVyODE5NzE3OTE@._V1_UX67_CR0,0,67,98_AL_.jpg",The Fault in Our Stars,Two teenage cancer patients begin a life-affirming journey to visit a reclusive author in Amsterdam.
"https://m.media-amazon.com/images/M/MV5BNTA1NzUzNjY4MV5BMl5BanBnXkFtZTgwNDU0MDI0NTE@._V1_UX67_CR0,0,67,98_AL_.jpg",Me and Earl and the Dying Girl,"High schooler Greg, who spends most of his time making parodies of classic movies with his co-worker Earl, finds his outlook forever altered after befriending a classmate who has just been diagnosed with cancer."
"https://m.media-amazon.com/images/M/MV5BODAzNDMxMzAxOV5BMl5BanBnXkFtZTgwMDMxMjA4MjE@._V1_UX67_CR0,0,67,98_AL_.jpg",Birdman or (The Unexpected Virtue of Ignorance),"A washed-up superhero actor attempts to revive his fading career by writing, directing, and starring in a Broadway production."
"https://m.media-amazon.com/images/M/MV5BMTQ5NTg5ODk4OV5BMl5BanBnXkFtZTgwODc4MTMzMDE@._V1_UX67_CR0,0,67,98_AL_.jpg",La vie d'Adèle,"Adèle's life is changed when she meets Emma, a young woman with blue hair, who will allow her to discover desire and to assert herself as a woman and as an adult. In front of others, Adèle grows, seeks herself, loses herself, and ultimately finds herself through love and loss."
"https://m.media-amazon.com/images/M/MV5BMTgwNTAwMjEzMF5BMl5BanBnXkFtZTcwNzMzODY4OA@@._V1_UY98_CR3,0,67,98_AL_.jpg",Kai po che!,Three friends growing up in India at the turn of the millennium set out to open a training academy to produce the country's next cricket stars.
"https://m.media-amazon.com/images/M/MV5BMTQzMzg2Nzg2MF5BMl5BanBnXkFtZTgwNjUzNzIzMDE@._V1_UX67_CR0,0,67,98_AL_.jpg",The Broken Circle Breakdown,"Elise and Didier fall in love at first sight, in spite of their differences. He talks, she listens. He's a romantic atheist, she's a religious realist. When their daughter becomes seriously ill, their love is put on trial."
"https://m.media-amazon.com/images/M/MV5BMzA2NDkwODAwM15BMl5BanBnXkFtZTgwODk5MTgzMTE@._V1_UY98_CR0,0,67,98_AL_.jpg",Captain America: The Winter Soldier,"As Steve Rogers struggles to embrace his role in the modern world, he teams up with a fellow Avenger and S.H.I.E.L.D agent, Black Widow, to battle a new threat from history: an assassin known as the Winter Soldier."
"https://m.media-amazon.com/images/M/MV5BOTc3NzAxMjg4M15BMl5BanBnXkFtZTcwMDc2ODQwNw@@._V1_UY98_CR3,0,67,98_AL_.jpg",Rockstar,"Janardhan Jakhar chases his dreams of becoming a big Rock star, during which he falls in love with Heer."
"https://m.media-amazon.com/images/M/MV5BOGQzODdlMDktNzU4ZC00N2M3LWFkYTAtYTM1NTE0ZWI5YTg4XkEyXkFqcGdeQXVyMTA1NTM1NDI2._V1_UX67_CR0,0,67,98_AL_.jpg",Nebraska,"An aging, booze-addled father makes the trip from Montana to Nebraska with his estranged son in order to claim a million-dollar Mega Sweepstakes Marketing prize."
"https://m.media-amazon.com/images/M/MV5BNzMxNTExOTkyMF5BMl5BanBnXkFtZTcwMzEyNDc0OA@@._V1_UX67_CR0,0,67,98_AL_.jpg",Wreck-It Ralph,"A video game villain wants to be a hero and sets out to fulfill his dream, but his quest brings havoc to the whole arcade where he lives."
"https://m.media-amazon.com/images/M/MV5BNjg0OTM5OTQyNV5BMl5BanBnXkFtZTgwNDg5NDQ0NTE@._V1_UY98_CR2,0,67,98_AL_.jpg",Le Petit Prince,"A little girl lives in a very grown-up world with her mother, who tries to prepare her for it. Her neighbor, the Aviator, introduces the girl to an extraordinary world where anything is possible, the world of the Little Prince."
"https://m.media-amazon.com/images/M/MV5BMTM3NzQzMDA5Ml5BMl5BanBnXkFtZTcwODA5NTcyNw@@._V1_UY98_CR0,0,67,98_AL_.jpg",Detachment,A substitute teacher who drifts from classroom to classroom finds a connection to the students and teachers during his latest assignment.
"https://m.media-amazon.com/images/M/MV5BMTM4NjY1MDQwMl5BMl5BanBnXkFtZTcwNTI3Njg3NA@@._V1_UX67_CR0,0,67,98_AL_.jpg",Midnight in Paris,"While on a trip to Paris with his fiancée's family, a nostalgic screenwriter finds himself mysteriously going back to the 1920s every day at midnight."
"https://m.media-amazon.com/images/M/MV5BMTg4MDk1ODExN15BMl5BanBnXkFtZTgwNzIyNjg3MDE@._V1_UX67_CR0,0,67,98_AL_.jpg",The Lego Movie,"An ordinary LEGO construction worker, thought to be the prophesied as ""special"", is recruited to join a quest to stop an evil tyrant from gluing the LEGO universe into eternal stasis."
"https://m.media-amazon.com/images/M/MV5BNjE5MzYwMzYxMF5BMl5BanBnXkFtZTcwOTk4MTk0OQ@@._V1_UX67_CR0,0,67,98_AL_.jpg",Gravity,Two astronauts work together to survive after an accident leaves them stranded in space.
"https://m.media-amazon.com/images/M/MV5BMTk2NzczOTgxNF5BMl5BanBnXkFtZTcwODQ5ODczOQ@@._V1_UX67_CR0,0,67,98_AL_.jpg",Star Trek Into Darkness,"After the crew of the Enterprise find an unstoppable force of terror from within their own organization, Captain Kirk leads a manhunt to a war-zone world to capture a one-man weapon of mass destruction."
"https://m.media-amazon.com/images/M/MV5BMTYwMzMzMDI0NF5BMl5BanBnXkFtZTgwNDQ3NjI3NjE@._V1_UX67_CR0,0,67,98_AL_.jpg",Beasts of No Nation,"A drama based on the experiences of Agu, a child soldier fighting in the civil war of an unnamed African country."
"https://m.media-amazon.com/images/M/MV5BOGUyZDUxZjEtMmIzMC00MzlmLTg4MGItZWJmMzBhZjE0Mjc1XkEyXkFqcGdeQXVyMTMxODk2OTU@._V1_UX67_CR0,0,67,98_AL_.jpg",The Social Network,"As Harvard student Mark Zuckerberg creates the social networking site that would become known as Facebook, he is sued by the twins who claimed he stole their idea, and by the co-founder who was later squeezed out of the business."
"https://m.media-amazon.com/images/M/MV5BMTg5OTMxNzk4Nl5BMl5BanBnXkFtZTcwOTk1MjAwNQ@@._V1_UX67_CR0,0,67,98_AL_.jpg",X: First Class,"In the 1960s, superpowered humans Charles Xavier and Erik Lensherr work together to find others like them, but Erik's vengeful pursuit of an ambitious mutant who ruined his life causes a schism to divide them."
