Poster_Link,Series_Title,Overview
"https://m.media-amazon.com/images/M/MV5BOTBmZDZkNWYtODIzYi00N2Y4LWFjMmMtNmM1OGYyNGVhYzUzXkEyXkFqcGdeQXVyNTAyODkwOQ@@._V1_UX67_CR0,0,67,98_AL_.jpg",La Vie En Rose,"Biopic of the iconic French singer Édith Piaf. Raised by her grandmother in a brothel, she was discovered while singing on a street corner at the age of 19. Despite her success, Piaf's life was filled with tragedy."
"https://m.media-amazon.com/images/M/MV5BMTI5MjA2Mzk2M15BMl5BanBnXkFtZTcwODY1MDUzMQ@@._V1_UX67_CR0,0,67,98_AL_.jpg",Huo Yuan Jia,"A biography of Chinese Martial Arts Master Huo Yuanjia, who is the founder and spiritual guru of the Jin Wu Sports Federation."
"https://m.media-amazon.com/images/M/MV5BY2VkMzZlZDAtNTkzNS00MDIzLWFmOTctMWQwZjQ1OWJiYzQ1XkEyXkFqcGdeQXVyNTIzOTk5ODM@._V1_UY98_CR1,0,67,98_AL_.jpg",The Illusionist,"In turn-of-the-century Vienna, a magician uses his abilities to secure the love of a woman far above his social standing."
"https://m.media-amazon.com/images/M/MV5BMTI5Mzk1MDc2M15BMl5BanBnXkFtZTcwMjIzMDA0MQ@@._V1_UX67_CR0,0,67,98_AL_.jpg",Dead Man's Shoes,A disaffected soldier returns to his hometown to get even with the thugs who brutalized his mentally-challenged brother years ago.
"https://m.media-amazon.com/images/M/MV5BNzU3NDg4NTAyNV5BMl5BanBnXkFtZTcwOTg2ODg1Mg@@._V1_UX67_CR0,0,67,98_AL_.jpg",Harry Potter and the Half-Blood Prince,"As Harry Potter begins his sixth year at Hogwarts, he discovers an old book marked as ""the property of the Half-Blood Prince"" and begins to learn more about Lord Voldemort's dark past."
"https://m.media-amazon.com/images/M/MV5BNWMxYTZlOTUtZDExMi00YzZmLTkwYTMtZmM2MmRjZmQ3OGY4XkEyXkFqcGdeQXVyMTAwMzUyMzUy._V1_UX67_CR0,0,67,98_AL_.jpg",300,King Leonidas of Sparta and a force of 300 men fight the Persians at Thermopylae in 480 B.C.
"https://m.media-amazon.com/images/M/MV5BMjRjOTMwMDEtNTY4NS00OWRjLWI4ZWItZDgwYmZhMzlkYzgxXkEyXkFqcGdeQXVyODIxOTg5MTc@._V1_UY98_CR1,0,67,98_AL_.jpg",Match Point,"At a turning point in his life, a former tennis pro falls for an actress who happens to be dating his friend and soon-to-be brother-in-law."
"https://m.media-amazon.com/images/M/MV5BY2IzNGNiODgtOWYzOS00OTI0LTgxZTUtOTA5OTQ5YmI3NGUzXkEyXkFqcGdeQXVyNjU0OTQ0OTY@._V1_UX67_CR0,0,67,98_AL_.jpg",Watchmen,"In 1985 where former superheroes exist, the murder of a colleague sends active vigilante Rorschach into his own sprawling investigation, uncovering something that could completely change the course of history as we know it."
"https://m.media-amazon.com/images/M/MV5BMTYzZWE3MDAtZjZkMi00MzhlLTlhZDUtNmI2Zjg3OWVlZWI0XkEyXkFqcGdeQXVyNDk3NzU2MTQ@._V1_UX67_CR0,0,67,98_AL_.jpg",Lord of War,An arms dealer confronts the morality of his work as he is being chased by an INTERPOL Agent.
"https://m.media-amazon.com/images/M/MV5BMzQ2ZTBhNmEtZDBmYi00ODU0LTgzZmQtNmMxM2M4NzM1ZjE4XkEyXkFqcGdeQXVyNjE5MjUyOTM@._V1_UX67_CR0,0,67,98_AL_.jpg",Saw,"Two strangers awaken in a room with no recollection of how they got there, and soon discover they're pawns in a deadly game perpetrated by a notorious serial killer."
"https://m.media-amazon.com/images/M/MV5BMjA0MjIyOTI3MF5BMl5BanBnXkFtZTcwODM5NTY5MQ@@._V1_UX67_CR0,0,67,98_AL_.jpg","Synecdoche, New York","A theatre director struggles with his work, and the women in his life, as he creates a life-size replica of New York City inside a warehouse as part of his new play."
"https://m.media-amazon.com/images/M/MV5BMTgxMjQ4NzE5OF5BMl5BanBnXkFtZTcwNzkwOTkyMQ@@._V1_UX67_CR0,0,67,98_AL_.jpg",Mysterious Skin,"A teenage hustler and a young man obsessed with alien abductions cross paths, together discovering a horrible, liberating truth."
"https://m.media-amazon.com/images/M/MV5BNjIwOGJhY2QtMTA5Yi00MDhlLWE5OTgtYmIzZDNlM2UwZjMyXkEyXkFqcGdeQXVyNTA4NzY1MzY@._V1_UX67_CR0,0,67,98_AL_.jpg",Jeux d'enfants,"As adults, best friends Julien and Sophie continue the odd game they started as children -- a fearless competition to outdo one another with daring and outrageous stunts. While they often act out to relieve one another's pain, their game might be a way to avoid the fact that they are truly meant for one another."
"https://m.media-amazon.com/images/M/MV5BZWI4ZTgwMzktNjk3Yy00OTlhLTg3YTAtMTA1MWVlMWJiOTRiXkEyXkFqcGdeQXVyMTAwMzUyOTc@._V1_UX67_CR0,0,67,98_AL_.jpg",Un long dimanche de fiançailles,"Tells the story of a young woman's relentless search for her fiancé, who has disappeared from the trenches of the Somme during World War One."
"https://m.media-amazon.com/images/M/MV5BMTUzNDgyMzg3Ml5BMl5BanBnXkFtZTcwMzIxNTAwMQ@@._V1_UX67_CR0,0,67,98_AL_.jpg",The Station Agent,"When his only friend dies, a man born with dwarfism moves to rural New Jersey to live a life of solitude, only to meet a chatty hot dog vendor and a woman dealing with her own personal loss."
"https://m.media-amazon.com/images/M/MV5BMjA4MjI2OTM5N15BMl5BanBnXkFtZTcwNDA1NjUzMw@@._V1_UX67_CR0,0,67,98_AL_.jpg",21 Grams,"A freak accident brings together a critically ill mathematician, a grieving mother, and a born-again ex-con."
"https://m.media-amazon.com/images/M/MV5BYmNlNDVjMWUtZDZjNS00YTBmLWE3NGUtNDcxMzE0YTQ2ODMxXkEyXkFqcGdeQXVyMTMxODk2OTU@._V1_UX67_CR0,0,67,98_AL_.jpg",Boksuneun naui geot,"A recently laid off factory worker kidnaps his former boss' friend's daughter, hoping to use the ransom money to pay for his sister's kidney transplant."
"https://m.media-amazon.com/images/M/MV5BMTMxNzYzNzUzMV5BMl5BanBnXkFtZTYwNjcwMjE3._V1_UX67_CR0,0,67,98_AL_.jpg",Finding Neverland,The story of Sir J.M. Barrie's friendship with a family who inspired him to create Peter Pan.
"https://m.media-amazon.com/images/M/MV5BNmE0YjdlYTktMTU4Ni00Mjk2LWI3NWMtM2RjNmFiOTk4YjYxL2ltYWdlXkEyXkFqcGdeQXVyNTAyODkwOQ@@._V1_UY98_CR1,0,67,98_AL_.jpg",25th Hour,"Cornered by the DEA, convicted New York drug dealer Montgomery Brogan reevaluates his life in the 24 remaining hours before facing a seven-year jail term."
"https://m.media-amazon.com/images/M/MV5BODNiZmY2MWUtMjFhMy00ZmM2LTg2MjYtNWY1OTY5NGU2MjdjL2ltYWdlXkEyXkFqcGdeQXVyNTAyODkwOQ@@._V1_UY98_CR0,0,67,98_AL_.jpg",The Butterfly Effect,"Evan Treborn suffers blackouts during significant events of his life. As he grows up, he finds a way to remember these lost memories and a supernatural way to alter his life by reading his journal."
"https://m.media-amazon.com/images/M/MV5BYTFkM2ViMmQtZmI5NS00MjQ2LWEyN2EtMTI1ZmNlZDU3MTZjXkEyXkFqcGdeQXVyNjU0OTQ0OTY@._V1_UX67_CR0,0,67,98_AL_.jpg",28 Days Later...,"Four weeks after a mysterious, incurable virus spreads throughout the UK, a handful of survivors try to find sanctuary."
"https://m.media-amazon.com/images/M/MV5BMDc2MGYwYzAtNzE2Yi00YmU3LTkxMDUtODk2YjhiNDM5NDIyXkEyXkFqcGdeQXVyMTEwNDU1MzEy._V1_UX67_CR0,0,67,98_AL_.jpg",Batoru rowaiaru,"In the future, the Japanese government captures a class of ninth-grade students and forces them to kill each other under the revolutionary ""Battle Royale"" act."
"https://m.media-amazon.com/images/M/MV5BYmUzODQ5MGItZTZlNy00MDBhLWIxMmItMjg4Y2QyNDFlMWQ2XkEyXkFqcGdeQXVyMTMxODk2OTU@._V1_UX67_CR0,0,67,98_AL_.jpg",The Royal Tenenbaums,The eccentric members of a dysfunctional family reluctantly gather under the same roof for various reasons.
"https://m.media-amazon.com/images/M/MV5BNDhjMzc3ZTgtY2Y4MC00Y2U3LWFiMDctZGM3MmM4N2YzNDQ5XkEyXkFqcGdeQXVyMTQxNzMzNDI@._V1_UX67_CR0,0,67,98_AL_.jpg",Y tu mamá también,"In Mexico, two teenage boys and an attractive older woman embark on a road trip and learn a thing or two about life, friendship, sex, and each other."
"https://m.media-amazon.com/images/M/MV5BNjQ3NWNlNmQtMTE5ZS00MDdmLTlkZjUtZTBlM2UxMGFiMTU3XkEyXkFqcGdeQXVyNjUwNzk3NDc@._V1_UX67_CR0,0,67,98_AL_.jpg",Harry Potter and the Sorcerer's Stone,"An orphaned boy enrolls in a school of wizardry, where he learns the truth about himself, his family and the terrible evil that haunts the magical world."
"https://m.media-amazon.com/images/M/MV5BMTAxMDE4Mzc3ODNeQTJeQWpwZ15BbWU4MDY2Mjg4MDcx._V1_UX67_CR0,0,67,98_AL_.jpg",The Others,A woman who lives in her darkened old family house with her two photosensitive children becomes convinced that the home is haunted.
"https://m.media-amazon.com/images/M/MV5BYjg5ZDkzZWEtZDQ2ZC00Y2ViLThhMzYtMmIxZDYzYTY2Y2Y2XkEyXkFqcGdeQXVyODAwMTU1MTE@._V1_UY98_CR1,0,67,98_AL_.jpg",Blow,"The story of how George Jung, along with the Medellín Cartel headed by Pablo Escobar, established the American cocaine market in the 1970s in the United States."
"https://m.media-amazon.com/images/M/MV5BYWFlY2E3ODQtZWNiNi00ZGU4LTkzNWEtZTQ2ZTViMWRhYjIzL2ltYWdlXkEyXkFqcGdeQXVyNTAyODkwOQ@@._V1_UX67_CR0,0,67,98_AL_.jpg",Enemy at the Gates,A Russian and a German sniper play a game of cat-and-mouse during the Battle of Stalingrad.
"https://m.media-amazon.com/images/M/MV5BZTI3YzZjZjEtMDdjOC00OWVjLTk0YmYtYzI2MGMwZjFiMzBlXkEyXkFqcGdeQXVyMTQxNzMzNDI@._V1_UX67_CR0,0,67,98_AL_.jpg",Minority Report,"In a future where a special police unit is able to arrest murderers before they commit their crimes, an officer from that unit is himself accused of a future murder."
"https://m.media-amazon.com/images/M/MV5BMTA3OTYxMzg0MDFeQTJeQWpwZ15BbWU4MDY1MjY0MTEx._V1_UX67_CR0,0,67,98_AL_.jpg",The Hurricane,"The story of Rubin 'Hurricane' Carter, a boxer wrongly imprisoned for murder, and the people who aided in his fight to prove his innocence."
"https://m.media-amazon.com/images/M/MV5BZTM2ZGJmNjQtN2UyOS00NjcxLWFjMDktMDE2NzMyNTZlZTBiXkEyXkFqcGdeQXVyNzkwMjQ5NzM@._V1_UX67_CR0,0,67,98_AL_.jpg",American Psycho,"A wealthy New York City investment banking executive, Patrick Bateman, hides his alternate psychopathic ego from his co-workers and friends as he delves deeper into his violent, hedonistic fantasies."
"https://m.media-amazon.com/images/M/MV5BMmU5ZjFmYjQtYmNjZC00Yjk4LWI1ZTQtZDJiMjM0YjQyNDU0L2ltYWdlL2ltYWdlXkEyXkFqcGdeQXVyMTQxNzMzNDI@._V1_UX67_CR0,0,67,98_AL_.jpg",Lola rennt,"After a botched money delivery, Lola has 20 minutes to come up with 100,000 Deutschmarks."
"https://m.media-amazon.com/images/M/MV5BYjEzMTM2NjAtNWFmZC00MTVlLTgyMmQtMGQyNTFjZDk5N2NmXkEyXkFqcGdeQXVyNzQ1ODk3MTQ@._V1_UX67_CR0,0,67,98_AL_.jpg",The Thin Red Line,"Adaptation of James Jones' autobiographical 1962 novel, focusing on the conflict at Guadalcanal during the second World War."
"https://m.media-amazon.com/images/M/MV5BODkxNGQ1NWYtNzg0Ny00Yjg3LThmZTItMjE2YjhmZTQ0ODY5XkEyXkFqcGdeQXVyMTQxNzMzNDI@._V1_UX67_CR0,0,67,98_AL_.jpg",Mulan,"To save her father from death in the army, a young maiden secretly goes in his place and becomes one of China's greatest heroines in the process."
"https://m.media-amazon.com/images/M/MV5BNjA2ZDY3ZjYtZmNiMC00MDU5LTgxMWEtNzk1YmI3NzdkMTU0XkEyXkFqcGdeQXVyNjQyMjcwNDM@._V1_UX67_CR0,0,67,98_AL_.jpg",Fear and Loathing in Las Vegas,An oddball journalist and his psychopathic lawyer travel to Las Vegas for a series of psychedelic escapades.
"https://m.media-amazon.com/images/M/MV5BMTkyNTAzZDYtNWUzYi00ODVjLTliZjYtNjc2YzJmODZhNTg3XkEyXkFqcGdeQXVyNjUxMDQ0MTg@._V1_UY98_CR6,0,67,98_AL_.jpg",Funny Games,"Two violent young men take a mother, father, and son hostage in their vacation cabin and force them to play sadistic ""games"" with one another for their own amusement."
"https://m.media-amazon.com/images/M/MV5BMGExOGExM2UtNWM5ZS00OWEzLTllNzYtM2NlMTJlYjBlZTJkXkEyXkFqcGdeQXVyMTQxNzMzNDI@._V1_UX67_CR0,0,67,98_AL_.jpg",Dark City,"A man struggles with memories of his past, which include a wife he cannot remember and a nightmarish world no one else ever seems to wake up from."
"https://m.media-amazon.com/images/M/MV5BMzk1MmI4NzAtOGRiNS00YjY1LTllNmEtZDhiZDM4MjU2NTMxXkEyXkFqcGdeQXVyNjc3MjQzNTI@._V1_UY98_CR1,0,67,98_AL_.jpg",Sleepers,"After a prank goes disastrously wrong, a group of boys are sent to a detention center where they are brutalized. Thirteen years later, an unexpected random encounter with a former guard gives them a chance for revenge."
"https://m.media-amazon.com/images/M/MV5BYWUxOWY4NDctMDFmMS00ZTQwLWExMGEtODg0ZWNhOTE5NzZmXkEyXkFqcGdeQXVyMTQxNzMzNDI@._V1_UY98_CR0,0,67,98_AL_.jpg",Lost Highway,"Anonymous videotapes presage a musician's murder conviction, and a gangster's girlfriend leads a mechanic astray."
"https://m.media-amazon.com/images/M/MV5BNzk1MjU3MDQyMl5BMl5BanBnXkFtZTcwNjc1OTM2MQ@@._V1_UX67_CR0,0,67,98_AL_.jpg",Sense and Sensibility,"Rich Mr. Dashwood dies, leaving his second wife and her three daughters poor by the rules of inheritance. The two eldest daughters are the title opposites."
"https://m.media-amazon.com/images/M/MV5BZjI0ZWFiMmQtMjRlZi00ZmFhLWI4NmYtMjQ5YmY0MzIyMzRiXkEyXkFqcGdeQXVyMTQxNzMzNDI@._V1_UX67_CR0,0,67,98_AL_.jpg",Die Hard: With a Vengeance,"John McClane and a Harlem store owner are targeted by German terrorist Simon in New York City, where he plans to rob the Federal Reserve Building."
"https://m.media-amazon.com/images/M/MV5BYTJlZmQ1OTAtODQzZi00NGIzLWI1MmEtZGE4NjFlOWRhODIyXkEyXkFqcGdeQXVyNTc1NTQxODI@._V1_UY98_CR0,0,67,98_AL_.jpg",Dead Man,"On the run after murdering a man, accountant William Blake encounters a strange aboriginal American man named Nobody who prepares him for his journey into the spiritual world."
"https://m.media-amazon.com/images/M/MV5BNmRiZDZkN2EtNWI5ZS00ZDg3LTgyNDItMWI5NjVlNmE5ODJiXkEyXkFqcGdeQXVyMjQwMjk0NjI@._V1_UX67_CR0,0,67,98_AL_.jpg",The Bridges of Madison County,Photographer Robert Kincaid wanders into the life of housewife Francesca Johnson for four days in the 1960s.
"https://m.media-amazon.com/images/M/MV5BNjEzYjJmNzgtNDkwNy00MTQ4LTlmMWMtNzA4YjE2NjI0ZDg4XkEyXkFqcGdeQXVyNjU0OTQ0OTY@._V1_UX67_CR0,0,67,98_AL_.jpg",Apollo 13,NASA must devise a strategy to return Apollo 13 to Earth safely after the spacecraft undergoes massive internal damage putting the lives of the three astronauts on board in jeopardy.
"https://m.media-amazon.com/images/M/MV5BNTliYTI1YTctMTE0Mi00NDM0LThjZDgtYmY3NGNiODBjZjAwXkEyXkFqcGdeQXVyMTAwMzUyOTc@._V1_UX67_CR0,0,67,98_AL_.jpg",Trois couleurs: Blanc,"After his wife divorces him, a Polish immigrant plots to get even with her."
"https://m.media-amazon.com/images/M/MV5BYjcxMzM3OWMtNmM3Yy00YzBkLTkxMmQtMDk4MmM3Y2Y4MDliL2ltYWdlXkEyXkFqcGdeQXVyMTQxNzMzNDI@._V1_UX67_CR0,0,67,98_AL_.jpg",Falling Down,An ordinary man frustrated with the various flaws he sees in society begins to psychotically and violently lash out against them.
"https://m.media-amazon.com/images/M/MV5BMTM5MDY5MDQyOV5BMl5BanBnXkFtZTgwMzM3NzMxMDE@._V1_UX67_CR0,0,67,98_AL_.jpg",Dazed and Confused,The adventures of high school and junior high students on the last day of school in May 1976.
"https://m.media-amazon.com/images/M/MV5BMTQxNDYzMTg1M15BMl5BanBnXkFtZTgwNzk4MDgxMTE@._V1_UX67_CR0,0,67,98_AL_.jpg",My Cousin Vinny,"Two New Yorkers accused of murder in rural Alabama while on their way back to college call in the help of one of their cousins, a loudmouth lawyer with no trial experience."
"https://m.media-amazon.com/images/M/MV5BMTY5NjI2MjQxMl5BMl5BanBnXkFtZTgwMDA2MzM2NzE@._V1_UY98_CR0,0,67,98_AL_.jpg",Omohide poro poro,A twenty-seven-year-old office worker travels to the countryside while reminiscing about her childhood in Tokyo.
"https://m.media-amazon.com/images/M/MV5BNjg5ZDM0MTEtYTZmNC00NDJiLWI5MTktYzk4N2QxY2IxZTc2L2ltYWdlXkEyXkFqcGdeQXVyNTAyODkwOQ@@._V1_UY98_CR3,0,67,98_AL_.jpg",Delicatessen,Post-apocalyptic surrealist black comedy about the landlord of an apartment building who occasionally prepares a delicacy for his odd tenants.
"https://m.media-amazon.com/images/M/MV5BMzFkM2YwOTQtYzk2Mi00N2VlLWE3NTItN2YwNDg1YmY0ZDNmXkEyXkFqcGdeQXVyMTMxODk2OTU@._V1_UX67_CR0,0,67,98_AL_.jpg",Home Alone,An eight-year-old troublemaker must protect his house from a pair of burglars when he is accidentally left home alone by his family during Christmas vacation.
"https://m.media-amazon.com/images/M/MV5BNWFlYWY2YjYtNjdhNi00MzVlLTg2MTMtMWExNzg4NmM5NmEzXkEyXkFqcGdeQXVyMDk5Mzc5MQ@@._V1_UX67_CR0,0,67,98_AL_.jpg",The Godfather: Part III,"Follows Michael Corleone, now in his 60s, as he seeks to free his family from crime and find a suitable successor to his empire."
"https://m.media-amazon.com/images/M/MV5BMjE0ODEwNjM2NF5BMl5BanBnXkFtZTcwMjU2Mzg3NA@@._V1_UX67_CR0,0,67,98_AL_.jpg",When Harry Met Sally...,"Harry and Sally have known each other for years, and are very good friends, but they fear sex would ruin the friendship."
"https://m.media-amazon.com/images/M/MV5BN2JlZTBhYTEtZDE3OC00NTA3LTk5NTQtNjg5M2RjODllM2M0XkEyXkFqcGdeQXVyNjk1Njg5NTA@._V1_UX67_CR0,0,67,98_AL_.jpg",The Little Mermaid,A mermaid princess makes a Faustian bargain in an attempt to become human and win a prince's love.
"https://m.media-amazon.com/images/M/MV5BODk1ZWM4ZjItMjFhZi00MDMxLTgxNmYtODFhNWZlZTkwM2UwXkEyXkFqcGdeQXVyMTQxNzMzNDI@._V1_UX67_CR0,0,67,98_AL_.jpg",The Naked Gun: From the Files of Police Squad!,Incompetent police Detective Frank Drebin must foil an attempt to assassinate Queen Elizabeth II.
"https://m.media-amazon.com/images/M/MV5BM2I1ZWNkYjEtYWY3ZS00MmMwLWI5OTEtNWNkZjNiYjIwNzY0XkEyXkFqcGdeQXVyNTI4MjkwNjA@._V1_UX67_CR0,0,67,98_AL_.jpg","Planes, Trains & Automobiles",A man must struggle to travel home for Thanksgiving with a lovable oaf of a shower curtain ring salesman as his only companion.
"https://m.media-amazon.com/images/M/MV5BZTllNWNlZjctMWQwMS00ZDc3LTg5ZjMtNzhmNzhjMmVhYTFlXkEyXkFqcGdeQXVyNTc1NTQxODI@._V1_UX67_CR0,0,67,98_AL_.jpg",Lethal Weapon,Two newly paired cops who are complete opposites must put aside their differences in order to catch a gang of drug smugglers.
"https://m.media-amazon.com/images/M/MV5BZmI5YzM1MjItMzFmNy00NGFkLThlMDUtZjZmYTZkM2QxMjU3XkEyXkFqcGdeQXVyNzkwMjQ5NzM@._V1_UX67_CR0,0,67,98_AL_.jpg",Blood Simple,"The owner of a seedy small-town Texas bar discovers that one of his employees is having an affair with his wife. A chaotic chain of misunderstandings, lies and mischief ensues after he devises a plot to have them murdered."
"https://m.media-amazon.com/images/M/MV5BNWQ4MGZlZmYtZjY0MS00N2JhLWE0NmMtOTMwMTk4NDQ4NjE2XkEyXkFqcGdeQXVyNTI4MjkwNjA@._V1_UX67_CR0,0,67,98_AL_.jpg",On Golden Pond,"Norman is a curmudgeon with an estranged relationship with his daughter Chelsea. At Golden Pond, he and his wife nevertheless agree to care for Billy, the son of Chelsea's new boyfriend, and a most unexpected relationship blooms."
"https://m.media-amazon.com/images/M/MV5BN2VlNjNhZWQtMTY2OC00Y2E1LWJkNGUtMDU4M2ViNzliMGYwXkEyXkFqcGdeQXVyNTAyODkwOQ@@._V1_UX67_CR0,0,67,98_AL_.jpg",Mad Max 2,"In the post-apocalyptic Australian wasteland, a cynical drifter agrees to help a small, gasoline-rich community escape a horde of bandits."
"https://m.media-amazon.com/images/M/MV5BYTU2MWRiMTMtYzAzZi00NGYzLTlkMDEtNWQ3MzZlNTJlNzZkL2ltYWdlL2ltYWdlXkEyXkFqcGdeQXVyNjc1NTYyMjg@._V1_UX67_CR0,0,67,98_AL_.jpg",The Warriors,"In the near future, a charismatic leader summons the street gangs of New York City in a bid to take it over. When he is killed, The Warriors are falsely blamed and now must fight their way home while every other gang is hunting them down."
"https://m.media-amazon.com/images/M/MV5BMGQ0OGM5YjItYzYyMi00NmVmLWI3ODMtMTY2NGRkZmI5MWU2XkEyXkFqcGdeQXVyMzI0NDc4ODY@._V1_UX67_CR0,0,67,98_AL_.jpg",The Muppet Movie,"Kermit and his newfound friends trek across America to find success in Hollywood, but a frog legs merchant is after Kermit."
"https://m.media-amazon.com/images/M/MV5BNDQ3MzNjMDItZjE0ZS00ZTYxLTgxNTAtM2I4YjZjNWFjYjJlL2ltYWdlXkEyXkFqcGdeQXVyNTAyODkwOQ@@._V1_UX67_CR0,0,67,98_AL_.jpg",Escape from Alcatraz,"Alcatraz is the most secure prison of its time. It is believed that no one can ever escape from it, until three daring men make a possible successful attempt at escaping from one of the most infamous prisons in the world."
"https://m.media-amazon.com/images/M/MV5BMzZiODUwNzktNzBiZi00MDc4LThkMGMtZmE3MTE0M2E1MTM3L2ltYWdlXkEyXkFqcGdeQXVyNTAyODkwOQ@@._V1_UX67_CR0,0,67,98_AL_.jpg",Watership Down,"Hoping to escape destruction by human developers and save their community, a colony of rabbits, led by Hazel and Fiver, seek out a safe place to set up a new warren."
"https://m.media-amazon.com/images/M/MV5BNDU1MjQ0YWMtMWQ2MS00NTdmLTg1MGItNDA5NTNkNTRhOTIyXkEyXkFqcGdeQXVyNTIzOTk5ODM@._V1_UX67_CR0,0,67,98_AL_.jpg",Midnight Express,"Billy Hayes, an American college student, is caught smuggling drugs out of Turkey and thrown into prison."
"https://m.media-amazon.com/images/M/MV5BMjM1NjE5NjQxN15BMl5BanBnXkFtZTgwMjYzMzQxMDE@._V1_UX67_CR0,0,67,98_AL_.jpg",Close Encounters of the Third Kind,"Roy Neary, an electric lineman, watches how his quiet and ordinary daily life turns upside down after a close encounter with a UFO."
"https://m.media-amazon.com/images/M/MV5BYzZhODNiOWYtMmNkNS00OTFhLTkzYzktYTQ4ZmNmZWMyN2ZiL2ltYWdlL2ltYWdlXkEyXkFqcGdeQXVyNjc1NTYyMjg@._V1_UX67_CR0,0,67,98_AL_.jpg",The Long Goodbye,"Private investigator Philip Marlowe helps a friend out of a jam, but in doing so gets implicated in his wife's murder."
"https://m.media-amazon.com/images/M/MV5BYjRmY2VjN2ItMzBmYy00YTRjLWFiMTgtNGZhNWJjMjk3YjZjXkEyXkFqcGdeQXVyNjc1NTYyMjg@._V1_UX67_CR0,0,67,98_AL_.jpg",Giù la testa,A low-life bandit and an I.R.A. explosives expert rebel against the government and become heroes of the Mexican Revolution.
"https://m.media-amazon.com/images/M/MV5BMzAyNDUwYzUtN2NlMC00ODliLWExMjgtMGMzNmYzZmUwYTg1XkEyXkFqcGdeQXVyNjc1NTYyMjg@._V1_UX67_CR0,0,67,98_AL_.jpg",Kelly's Heroes,A group of U.S. soldiers sneaks across enemy lines to get their hands on a secret stash of Nazi treasure.
"https://m.media-amazon.com/images/M/MV5BMjAwMTExODExNl5BMl5BanBnXkFtZTgwMjM2MDgyMTE@._V1_UX67_CR0,0,67,98_AL_.jpg",The Jungle Book,Bagheera the Panther and Baloo the Bear have a difficult time trying to convince a boy to leave the jungle for human civilization.
"https://m.media-amazon.com/images/M/MV5BYTE4YWU0NjAtMjNiYi00MTNiLTgwYzctZjk0YjY5NGVhNWQwXkEyXkFqcGdeQXVyMTY5Nzc4MDY@._V1_UY98_CR0,0,67,98_AL_.jpg",Blowup,A fashion photographer unknowingly captures a death on film after following two lovers in a park.
"https://m.media-amazon.com/images/M/MV5BZjQyMGUwNzAtNTc2MC00Y2FjLThlM2ItZGRjNzM0OWVmZGYyXkEyXkFqcGdeQXVyNjc1NTYyMjg@._V1_UX67_CR0,0,67,98_AL_.jpg",A Hard Day's Night,"Over two ""typical"" days in the life of The Beatles, the boys struggle to keep themselves and Sir Paul McCartney's mischievous grandfather in check while preparing for a live television performance."
"https://m.media-amazon.com/images/M/MV5BNGEwMTRmZTQtMDY4Ni00MTliLTk5ZmMtOWMxYWMyMTllMDg0L2ltYWdlL2ltYWdlXkEyXkFqcGdeQXVyNjc1NTYyMjg@._V1_UX67_CR0,0,67,98_AL_.jpg",Breakfast at Tiffany's,"A young New York socialite becomes interested in a young man who has moved into her apartment building, but her past threatens to get in the way."
"https://m.media-amazon.com/images/M/MV5BODk3YjdjZTItOGVhYi00Mjc2LTgzMDAtMThmYTVkNTBlMWVkXkEyXkFqcGdeQXVyNDY2MTk1ODk@._V1_UX67_CR0,0,67,98_AL_.jpg",Giant,Sprawling epic covering the life of a Texas cattle rancher and his family and associates.
"https://m.media-amazon.com/images/M/MV5BM2U3YzkxNGMtYWE0YS00ODk0LTk1ZGEtNjk3ZTE0MTk4MzJjXkEyXkFqcGdeQXVyNDk0MDg4NDk@._V1_UX67_CR0,0,67,98_AL_.jpg",From Here to Eternity,"In Hawaii in 1941, a private is cruelly punished for not boxing on his unit's team, while his captain's wife and second-in-command are falling in love."
"https://m.media-amazon.com/images/M/MV5BZTBmMjUyMjItYTM4ZS00MjAwLWEyOGYtYjMyZTUxN2I3OTMxXkEyXkFqcGdeQXVyNjc1NTYyMjg@._V1_UX67_CR0,0,67,98_AL_.jpg",Lifeboat,Several survivors of a torpedoed merchant ship in World War II find themselves in the same lifeboat with one of the crew members of the U-boat that sank their ship.
"https://m.media-amazon.com/images/M/MV5BMTY5ODAzMTcwOF5BMl5BanBnXkFtZTcwMzYxNDYyNA@@._V1_UX67_CR0,0,67,98_AL_.jpg",The 39 Steps,"A man in London tries to help a counter-espionage Agent. But when the Agent is killed, and the man stands accused, he must go on the run to save himself and stop a spy ring which is trying to steal top secret information."
