Poster_Link,Series_Title,Overview
"https://m.media-amazon.com/images/M/MV5BNGQwZjg5YmYtY2VkNC00NzliLTljYTctNzI5NmU3MjE2ODQzXkEyXkFqcGdeQXVyNzkwMjQ5NzM@._V1_UX67_CR0,0,67,98_AL_.jpg",The Hangover,"Three buddies wake up from a bachelor party in Las Vegas, with no memory of the previous night and the bachelor missing. They make their way around the city in order to find their friend before his wedding."
"https://m.media-amazon.com/images/M/MV5BMWZiNjE2OWItMTkwNy00ZWQzLWI0NTgtMWE0NjNiYTljN2Q1XkEyXkFqcGdeQXVyNzAwMjYxMzA@._V1_UX67_CR0,0,67,98_AL_.jpg",Skyfall,"James Bond's loyalty to M is tested when her past comes back to haunt her. When MI6 comes under attack, 007 must track down and destroy the threat, no matter how personal the cost."
"https://m.media-amazon.com/images/M/MV5BMTM2MTI5NzA3MF5BMl5BanBnXkFtZTcwODExNTc0OA@@._V1_UX67_CR0,0,67,98_AL_.jpg",Silver Linings Playbook,"After a stint in a mental institution, former teacher Pat Solitano moves back in with his parents and tries to reconcile with his ex-wife. Things get more challenging when Pat meets Tiffany, a mysterious girl with problems of her own."
"https://m.media-amazon.com/images/M/MV5BNzljNjY3MDYtYzc0Ni00YjU0LWIyNDUtNTE0ZDRiMGExMjZlXkEyXkFqcGdeQXVyMTMxODk2OTU@._V1_UX67_CR0,0,67,98_AL_.jpg",Argo,"Acting under the cover of a Hollywood producer scouting a location for a science fiction film, a CIA agent launches a dangerous operation to rescue six Americans in Tehran during the U.S. hostage crisis in Iran in 1979."
"https://m.media-amazon.com/images/M/MV5BMTk5MjM4OTU1OV5BMl5BanBnXkFtZTcwODkzNDIzMw@@._V1_UX67_CR0,0,67,98_AL_.jpg",(500) Days of Summer,"An offbeat romantic comedy about a woman who doesn't believe true love exists, and the young man who falls for her."
"https://m.media-amazon.com/images/M/MV5BMTQ2OTE1Mjk0N15BMl5BanBnXkFtZTcwODE3MDAwNA@@._V1_UX67_CR0,0,67,98_AL_.jpg",Harry Potter and the Deathly Hallows: Part 1,"As Harry, Ron, and Hermione race against time and evil to destroy the Horcruxes, they uncover the existence of the three most powerful objects in the wizarding world: the Deathly Hallows."
"https://m.media-amazon.com/images/M/MV5BOTc3YmM3N2QtODZkMC00ZDE5LThjMTQtYTljN2Y1YTYwYWJkXkEyXkFqcGdeQXVyODEzNjM5OTQ@._V1_UX67_CR0,0,67,98_AL_.jpg",Gake no ue no Ponyo,"A five-year-old boy develops a relationship with Ponyo, a young goldfish princess who longs to become a human after falling in love with him."
"https://m.media-amazon.com/images/M/MV5BOTY4NTU2NTU4NF5BMl5BanBnXkFtZTcwNjE0OTc5MQ@@._V1_UX67_CR0,0,67,98_AL_.jpg",Frost/Nixon,A dramatic retelling of the post-Watergate television interviews between British talk-show host David Frost and former president Richard Nixon.
"https://m.media-amazon.com/images/M/MV5BNDliMTMxOWEtODM3Yi00N2QwLTg4YTAtNTE5YzBlNTA2NjhlXkEyXkFqcGdeQXVyNjE5MjUyOTM@._V1_UX67_CR0,0,67,98_AL_.jpg",Papurika,"When a machine that allows therapists to enter their patients' dreams is stolen, all Hell breaks loose. Only a young female therapist, Paprika, can stop it."
"https://m.media-amazon.com/images/M/MV5BOTA1Mzg3NjIxNV5BMl5BanBnXkFtZTcwNzU2NTc5MQ@@._V1_UX67_CR0,0,67,98_AL_.jpg",Changeling,Grief-stricken mother Christine Collins (Angelina Jolie) takes on the L.A.P.D. to her own detriment when it tries to pass off an obvious impostor as her missing child.
"https://m.media-amazon.com/images/M/MV5BMTU2NjQ1Nzc4MF5BMl5BanBnXkFtZTcwNTM0NDk1Mw@@._V1_UX67_CR0,0,67,98_AL_.jpg",Flipped,Two eighth-graders start to have feelings for each other despite being total opposites.
"https://m.media-amazon.com/images/M/MV5BMzA4ZGM1NjYtMjcxYS00MTdiLWJmNzEtMTUzODY0NDQ0YzUzXkEyXkFqcGdeQXVyMzYwMjQ3OTI@._V1_UY98_CR1,0,67,98_AL_.jpg",Toki o kakeru shôjo,"A high-school girl named Makoto acquires the power to travel back in time, and decides to use it for her own personal benefits. Little does she know that she is affecting the lives of others just as much as she is her own."
"https://m.media-amazon.com/images/M/MV5BZDNlNjEzMzQtZDM0MS00YzhiLTk0MGUtYTdmNDZiZGVjNTk0L2ltYWdlXkEyXkFqcGdeQXVyNTAyODkwOQ@@._V1_UY98_CR1,0,67,98_AL_.jpg",Death Note: Desu nôto,"A battle between the world's two greatest minds begins when Light Yagami finds the Death Note, a notebook with the power to kill, and decides to rid the world of criminals."
"https://m.media-amazon.com/images/M/MV5BMmE3OWZhZDYtOTBjMi00NDIwLTg1NWMtMjg0NjJmZWM4MjliL2ltYWdlXkEyXkFqcGdeQXVyNTAyODkwOQ@@._V1_UX67_CR0,0,67,98_AL_.jpg",This Is England,"A young boy becomes friends with a gang of skinheads. Friends soon become like family, and relationships will be pushed to the very limit."
"https://m.media-amazon.com/images/M/MV5BMTUxNzc0OTIxMV5BMl5BanBnXkFtZTgwNDI3NzU2NDE@._V1_UX67_CR0,0,67,98_AL_.jpg",Ex Machina,A young programmer is selected to participate in a ground-breaking experiment in synthetic intelligence by evaluating the human qualities of a highly advanced humanoid A.I.
"https://m.media-amazon.com/images/M/MV5BMjIxODEyOTQ5Ml5BMl5BanBnXkFtZTcwNjE3NzI5Mw@@._V1_UY98_CR1,0,67,98_AL_.jpg",Efter brylluppet,"A manager of an orphanage in India is sent to Copenhagen, Denmark, where he discovers a life-altering family secret."
"https://m.media-amazon.com/images/M/MV5BMjM1NTkxNjkzMl5BMl5BanBnXkFtZTgwNDgwMDAxMzE@._V1_UY98_CR1,0,67,98_AL_.jpg",The Last King of Scotland,Based on the events of the brutal Ugandan dictator Idi Amin's regime as seen by his personal physician during the 1970s.
"https://m.media-amazon.com/images/M/MV5BN2UwNDc5NmEtNjVjZS00OTI5LWE5YjctMWM3ZjBiZGYwMGI2XkEyXkFqcGdeQXVyNzkwMjQ5NzM@._V1_UX67_CR0,0,67,98_AL_.jpg",Zodiac,"In the late 1960s/early 1970s, a San Francisco cartoonist becomes an amateur detective obsessed with tracking down the Zodiac Killer, an unidentified individual who terrorizes Northern California with a killing spree."
"https://m.media-amazon.com/images/M/MV5BZjczMWI1YWMtYTZjOS00ZDc5LWE2MWItMTY3ZGUxNzFkNjJmL2ltYWdlXkEyXkFqcGdeQXVyNjU0OTQ0OTY@._V1_UX67_CR0,0,67,98_AL_.jpg",Lucky Number Slevin,"A case of mistaken identity lands Slevin into the middle of a war being plotted by two of the city's most rival crime bosses. Under constant surveillance by Detective Brikowski and assassin Goodkat, he must get them before they get him."
"https://m.media-amazon.com/images/M/MV5BMTQyODczNjU3NF5BMl5BanBnXkFtZTcwNjQ0NDIzMQ@@._V1_UX67_CR0,0,67,98_AL_.jpg",Joyeux Noël,"In December 1914, an unofficial Christmas truce on the Western, Front allows soldiers from opposing sides of the First World War to gain insight into each other's way of life."
"https://m.media-amazon.com/images/M/MV5BNTEzOTYwMTcxN15BMl5BanBnXkFtZTcwNTgyNjI1MQ@@._V1_UX67_CR0,0,67,98_AL_.jpg",Control,"A profile of Ian Curtis, the enigmatic singer of Joy Division whose personal, professional, and romantic troubles led him to commit suicide at the age of 23."
"https://m.media-amazon.com/images/M/MV5BMTAxNDYxMjg0MjNeQTJeQWpwZ15BbWU3MDcyNTk2OTM@._V1_UX67_CR0,0,67,98_AL_.jpg",Tangled,"The magically long-haired Rapunzel has spent her entire life in a tower, but now that a runaway thief has stumbled upon her, she is about to discover the world for the first time, and who she really is."
"https://m.media-amazon.com/images/M/MV5BODFlNTI0ZWQtOTcxNC00OTc0LTkwZDUtMmNkM2I1ZWFlYzZkXkEyXkFqcGdeQXVyNTIzOTk5ODM@._V1_UY98_CR2,0,67,98_AL_.jpg",Zwartboek,"In the Nazi-occupied Netherlands during World War II, a Jewish singer infiltrates the regional Gestapo headquarters for the Dutch resistance."
"https://m.media-amazon.com/images/M/MV5BMTY5NTAzNTc1NF5BMl5BanBnXkFtZTYwNDY4MDc3._V1_UX67_CR0,0,67,98_AL_.jpg",Brokeback Mountain,"The story of a forbidden and secretive relationship between two cowboys, and their lives over the years."
"https://m.media-amazon.com/images/M/MV5BODE0NTcxNTQzNF5BMl5BanBnXkFtZTcwMzczOTIzMw@@._V1_UX67_CR0,0,67,98_AL_.jpg",3:10 to Yuma,A small-time rancher agrees to hold a captured outlaw who's awaiting a train to go to court in Yuma. A battle of wills ensues as the outlaw tries to psych out the rancher.
"https://m.media-amazon.com/images/M/MV5BOTk1OTA1MjIyNV5BMl5BanBnXkFtZTcwODQxMTkyMQ@@._V1_UX67_CR0,0,67,98_AL_.jpg",Crash,"Los Angeles citizens with vastly separate lives collide in interweaving stories of race, loss and redemption."
"https://m.media-amazon.com/images/M/MV5BMjZiOTNlMzYtZWYwZS00YWJjLTk5NDgtODkwNjRhMDI0MjhjXkEyXkFqcGdeQXVyMjgyNjk3MzE@._V1_UY98_CR1,0,67,98_AL_.jpg",Kung fu,"In Shanghai, China in the 1940s, a wannabe gangster aspires to join the notorious ""Axe Gang"" while residents of a housing complex exhibit extraordinary powers in defending their turf."
"https://m.media-amazon.com/images/M/MV5BYTIyMDFmMmItMWQzYy00MjBiLTg2M2UtM2JiNDRhOWE4NjBhXkEyXkFqcGdeQXVyNjU0OTQ0OTY@._V1_UX67_CR0,0,67,98_AL_.jpg",The Bourne Supremacy,"When Jason Bourne is framed for a CIA operation gone awry, he is forced to resume his former life as a trained assassin to survive."
"https://m.media-amazon.com/images/M/MV5BNjk1NzBlY2YtNjJmNi00YTVmLWI2OTgtNDUxNDE5NjUzZmE0XkEyXkFqcGdeQXVyNTc1NTQxODI@._V1_UX67_CR0,0,67,98_AL_.jpg",The Machinist,An industrial worker who hasn't slept in a year begins to doubt his own sanity.
"https://m.media-amazon.com/images/M/MV5BMTQxNDQwNjQzOV5BMl5BanBnXkFtZTcwNTQxNDYyMQ@@._V1_UX67_CR0,0,67,98_AL_.jpg",Ray,"The story of the life and career of the legendary rhythm and blues musician Ray Charles, from his humble beginnings in the South, where he went blind at age seven, to his meteoric rise to stardom during the 1950s and 1960s."
"https://m.media-amazon.com/images/M/MV5BMTI2NDI5ODk4N15BMl5BanBnXkFtZTYwMTI3NTE3._V1_UX67_CR0,0,67,98_AL_.jpg",Lost in Translation,A faded movie star and a neglected young woman form an unlikely bond after crossing paths in Tokyo.
"https://m.media-amazon.com/images/M/MV5BMTI1NDMyMjExOF5BMl5BanBnXkFtZTcwOTc4MjQzMQ@@._V1_UX67_CR0,0,67,98_AL_.jpg",Harry Potter and the Goblet of Fire,"Harry Potter finds himself competing in a hazardous tournament between rival schools of magic, but he is distracted by recurring nightmares."
"https://m.media-amazon.com/images/M/MV5BODFlMmEwMDgtYjhmZi00ZTE5LTk2NWQtMWE1Y2M0NjkzOGYxXkEyXkFqcGdeQXVyNjU0OTQ0OTY@._V1_UX67_CR0,0,67,98_AL_.jpg",Man on Fire,"In Mexico City, a former CIA operative swears vengeance on those who committed an unspeakable act against the family he was hired to protect."
"https://m.media-amazon.com/images/M/MV5BMzQxNjM5NzkxNV5BMl5BanBnXkFtZTcwMzg5NDMwMg@@._V1_UX67_CR0,0,67,98_AL_.jpg",Coraline,"An adventurous 11-year-old girl finds another world that is a strangely idealized version of her frustrating home, but it has sinister secrets."
"https://m.media-amazon.com/images/M/MV5BMzkyNzQ1Mzc0NV5BMl5BanBnXkFtZTcwODg3MzUzMw@@._V1_UX67_CR0,0,67,98_AL_.jpg",The Last Samurai,An American military advisor embraces the Samurai culture he was hired to destroy after he is captured in battle.
"https://m.media-amazon.com/images/M/MV5BMTI2NzU1NTc1NF5BMl5BanBnXkFtZTcwOTQ1MjAwMQ@@._V1_UX67_CR0,0,67,98_AL_.jpg",The Magdalene Sisters,Three young Irish women struggle to maintain their spirits while they endure dehumanizing abuse as inmates of a Magdalene Sisters Asylum.
"https://m.media-amazon.com/images/M/MV5BMTI0MTg4NzI3M15BMl5BanBnXkFtZTcwOTE0MTUyMQ@@._V1_UY98_CR0,0,67,98_AL_.jpg",Good Bye Lenin!,"In 1990, to protect his fragile mother from a fatal shock after a long coma, a young man must keep her from learning that her beloved nation of East Germany as she knew it has disappeared."
"https://m.media-amazon.com/images/M/MV5BOGY1YmUzN2MtNDQ3NC00Nzc4LWI5M2EtYzUwMGQ4NWM4NjE1XkEyXkFqcGdeQXVyMTQxNzMzNDI@._V1_UY98_CR0,0,67,98_AL_.jpg",In America,A family of Irish immigrants adjust to life on the mean streets of Hell's Kitchen while also grieving the death of a child.
"https://m.media-amazon.com/images/M/MV5BYzEyNzc0NjctZjJiZC00MWI1LWJlOTMtYWZkZDAzNzQ0ZDNkXkEyXkFqcGdeQXVyMTQxNzMzNDI@._V1_UX67_CR0,0,67,98_AL_.jpg",I Am Sam,A mentally handicapped man fights for custody of his 7-year-old daughter and in the process teaches his cold-hearted lawyer the value of love and family.
"https://m.media-amazon.com/images/M/MV5BZjIwZWU0ZDItNzBlNS00MDIwLWFlZjctZTJjODdjZWYxNzczL2ltYWdlXkEyXkFqcGdeQXVyMTMxODk2OTU@._V1_UX67_CR0,0,67,98_AL_.jpg",Adaptation.,A lovelorn screenwriter becomes desperate as he tries and fails to adapt 'The Orchid Thief' by Susan Orlean for the screen.
"https://m.media-amazon.com/images/M/MV5BYWMwMzQxZjQtODM1YS00YmFiLTk1YjQtNzNiYWY1MDE4NTdiXkEyXkFqcGdeQXVyNDYyMDk5MTU@._V1_UX67_CR0,0,67,98_AL_.jpg",Black Hawk Down,160 elite U.S. soldiers drop into Somalia to capture two top lieutenants of a renegade warlord and find themselves in a desperate battle with a large force of heavily-armed Somalis.
"https://m.media-amazon.com/images/M/MV5BNjcxMmQ0MmItYTkzYy00MmUyLTlhOTQtMmJmNjE3MDMwYjdlXkEyXkFqcGdeQXVyNzkwMjQ5NzM@._V1_UX67_CR0,0,67,98_AL_.jpg",Road to Perdition,"A mob enforcer's son witnesses a murder, forcing him and his father to take to the road, and his father down a path of redemption and revenge."
"https://m.media-amazon.com/images/M/MV5BNThiMDc1YjUtYmE3Zi00MTM1LTkzM2MtNjdlNzQ4ZDlmYjRmXkEyXkFqcGdeQXVyMTQxNzMzNDI@._V1_UY98_CR1,0,67,98_AL_.jpg",Das Experiment,"For two weeks, 20 male participants are hired to play prisoners and guards in a prison. The ""prisoners"" have to follow seemingly mild rules, and the ""guards"" are told to retain order without using physical violence."
"https://m.media-amazon.com/images/M/MV5BNGY3NWYwNzctNWU5Yi00ZjljLTgyNDgtZjNhZjRlNjc0ZTU1XkEyXkFqcGdeQXVyMTQxNzMzNDI@._V1_UX67_CR0,0,67,98_AL_.jpg",Billy Elliot,A talented young boy becomes torn between his unexpected love of dance and the disintegration of his family.
"https://m.media-amazon.com/images/M/MV5BZGY5NWUyNDUtZWJhZi00ZjMxLWFmMjMtYmJhZjVkZGZhNWQ4XkEyXkFqcGdeQXVyMTQxNzMzNDI@._V1_UX67_CR0,0,67,98_AL_.jpg",Hedwig and the Angry Inch,A gender-queer punk-rock singer from East Berlin tours the U.S. with her band as she tells her life story and follows the former lover/band-mate who stole her songs.
"https://m.media-amazon.com/images/M/MV5BYzVmYzVkMmUtOGRhMi00MTNmLThlMmUtZTljYjlkMjNkMjJkXkEyXkFqcGdeQXVyNDk3NzU2MTQ@._V1_UX67_CR0,0,67,98_AL_.jpg",Ocean's Eleven,Danny Ocean and his ten accomplices plan to rob three Las Vegas casinos simultaneously.
"https://m.media-amazon.com/images/M/MV5BNTIyNThlMjMtMzUyMi00YmEyLTljMmYtMWRhN2Q3ZTllZjA4XkEyXkFqcGdeQXVyMzM4MjM0Nzg@._V1_UY98_CR1,0,67,98_AL_.jpg",Vampire Hunter D: Bloodlust,"When a girl is abducted by a vampire, a legendary bounty hunter is hired to bring her back."
"https://m.media-amazon.com/images/M/MV5BMjZkOTdmMWItOTkyNy00MDdjLTlhNTQtYzU3MzdhZjA0ZDEyXkEyXkFqcGdeQXVyMTMxODk2OTU@._V1_UX67_CR0,0,67,98_AL_.jpg","O Brother, Where Art Thou?","In the deep south during the 1930s, three escaped convicts search for hidden treasure while a relentless lawman pursues them."
"https://m.media-amazon.com/images/M/MV5BZDYwYzlhOTAtNDAwMC00ZTBhLWI4M2QtMTA1NmJhYTdiNTkxXkEyXkFqcGdeQXVyNTM0NTU5Mg@@._V1_UX67_CR0,0,67,98_AL_.jpg",Interstate 60: Episodes of the Road,"Neal Oliver, a very confused young man and an artist, takes a journey of a lifetime on a highway I60 that doesn't exist on any of the maps, going to the places he never even heard of, searching for an answer and his dreamgirl."
"https://m.media-amazon.com/images/M/MV5BOGE0ZWI0YzAtY2NkZi00YjkyLWIzYWEtNTJmMzJjODllNjdjXkEyXkFqcGdeQXVyMTQxNzMzNDI@._V1_UX67_CR0,0,67,98_AL_.jpg","South Park: Bigger, Longer & Uncut","When Stan Marsh and his friends go see an R-rated movie, they start cursing and their parents think that Canada is to blame."
"https://m.media-amazon.com/images/M/MV5BOTA5MzQ3MzI1NV5BMl5BanBnXkFtZTgwNTcxNTYxMTE@._V1_UX67_CR0,0,67,98_AL_.jpg",Office Space,Three company workers who hate their jobs decide to rebel against their greedy boss.
"https://m.media-amazon.com/images/M/MV5BM2FlNzE0ZmUtMmVkZS00MWQ3LWE4OWQtYjQwZjdhNzRmNWE2XkEyXkFqcGdeQXVyMTAwMzUyOTc@._V1_UX67_CR0,0,67,98_AL_.jpg",Happiness,"The lives of several individuals intertwine as they go about their lives in their own unique ways, engaging in acts society as a whole might find disturbing in a desperate search for human connection."
"https://m.media-amazon.com/images/M/MV5BMDZkMTUxYWEtMDY5NS00ZTA5LTg3MTItNTlkZWE1YWRjYjMwL2ltYWdlL2ltYWdlXkEyXkFqcGdeQXVyMTQxNzMzNDI@._V1_UX67_CR0,0,67,98_AL_.jpg",Training Day,A rookie cop spends his first day as a Los Angeles narcotics officer with a rogue detective who isn't what he appears to be.
"https://m.media-amazon.com/images/M/MV5BMjE2OTc3OTk2M15BMl5BanBnXkFtZTgwMjg2NjIyMDE@._V1_UX67_CR0,0,67,98_AL_.jpg",Rushmore,The extracurricular king of Rushmore Preparatory School is put on academic probation.
"https://m.media-amazon.com/images/M/MV5BYjA2MTA1MjUtYmUyNy00NGZiLTk2NTAtMDk3N2M3YmMwOTc1XkEyXkFqcGdeQXVyMjA0MzYwMDY@._V1_UY98_CR0,0,67,98_AL_.jpg",Abre los ojos,"A very handsome man finds the love of his life, but he suffers an accident and needs to have his face rebuilt by surgery after it is severely disfigured."
"https://m.media-amazon.com/images/M/MV5BYmUxY2MyOTQtYjRlMi00ZWEwLTkzODctZDMxNDcyNTFhYjNjXkEyXkFqcGdeQXVyNDk3NzU2MTQ@._V1_UY98_CR1,0,67,98_AL_.jpg",Being John Malkovich,A puppeteer discovers a portal that leads literally into the head of movie star John Malkovich.
"https://m.media-amazon.com/images/M/MV5BNWMxZTgzMWEtMTU0Zi00NDc5LWFkZjctMzUxNDIyNzZiMmNjXkEyXkFqcGdeQXVyMTQxNzMzNDI@._V1_UX67_CR0,0,67,98_AL_.jpg",As Good as It Gets,"A single mother and waitress, a misanthropic author, and a gay artist form an unlikely friendship after the artist is assaulted in a robbery."
"https://m.media-amazon.com/images/M/MV5BZWFjYmZmZGQtYzg4YS00ZGE5LTgwYzAtZmQwZjQ2NDliMGVmXkEyXkFqcGdeQXVyNTUyMzE4Mzg@._V1_UY98_CR0,0,67,98_AL_.jpg",The Fifth Element,"In the colorful future, a cab driver unwittingly becomes the central figure in the search for a legendary cosmic weapon to keep Evil and Mr. Zorg at bay."
"https://m.media-amazon.com/images/M/MV5BZjFkOWM5NDUtODYwOS00ZDg0LWFkZGUtYzBkYzNjZjU3ODE3XkEyXkFqcGdeQXVyNzQzNzQxNzI@._V1_UX67_CR0,0,67,98_AL_.jpg",Le dîner de cons,"A few friends have a weekly fools' dinner, where each brings a fool along. Pierre finds a champion fool for next dinner. Surprise."
"https://m.media-amazon.com/images/M/MV5BYzMzMDZkYWEtODIzNS00YjI3LTkxNTktOWEyZGM3ZWI2MWM4XkEyXkFqcGdeQXVyNzkwMjQ5NzM@._V1_UX67_CR0,0,67,98_AL_.jpg",Donnie Brasco,"An FBI undercover agent infiltrates the mob and finds himself identifying more with the mafia life, at the expense of his regular one."
"https://m.media-amazon.com/images/M/MV5BMTQzMzcxMzUyMl5BMl5BanBnXkFtZTgwNDI1MjgxMTE@._V1_UX67_CR0,0,67,98_AL_.jpg",Shine,"Pianist David Helfgott, driven by his father and teachers, has a breakdown. Years later he returns to the piano, to popular if not critical acclaim."
"https://m.media-amazon.com/images/M/MV5BZTM2NWI2OGYtYWNhMi00ZTlmLTg2ZTAtMmI5NWRjODA5YTE1XkEyXkFqcGdeQXVyODE2OTYwNTg@._V1_UX67_CR0,0,67,98_AL_.jpg",Primal Fear,"An altar boy is accused of murdering a priest, and the truth is buried several layers deep."
"https://m.media-amazon.com/images/M/MV5BM2U5OWM5NWQtZDYwZS00NmI3LTk4NDktNzcwZjYzNmEzYWU1XkEyXkFqcGdeQXVyNjMwMjk0MTQ@._V1_UY98_CR0,0,67,98_AL_.jpg",Hamlet,"Hamlet, Prince of Denmark, returns home to find his father murdered and his mother remarrying the murderer, his uncle. Meanwhile, war is brewing."
"https://m.media-amazon.com/images/M/MV5BZDQzMGE5ODYtZDdiNC00MzZjLTg2NjAtZTk0ODlkYmY4MTQzXkEyXkFqcGdeQXVyMTQxNzMzNDI@._V1_UX67_CR0,0,67,98_AL_.jpg",A Little Princess,A young girl is relegated to servitude at a boarding school when her father goes missing and is presumed dead.
"https://m.media-amazon.com/images/M/MV5BZjM4NWRhYTQtYTJlNC00ZmMyLWEzNTAtZDA2MjJjYTQ5ZTVmXkEyXkFqcGdeQXVyMTQxNzMzNDI@._V1_UX67_CR0,0,67,98_AL_.jpg",Do lok tin si,"This Hong Kong-set crime drama follows the lives of a hitman, hoping to get out of the business, and his elusive female partner."
"https://m.media-amazon.com/images/M/MV5BZmVhNWIzOTMtYmVlZC00ZDVmLWIyODEtODEzOTAxYjAwMzVlXkEyXkFqcGdeQXVyMzIwNDY4NDI@._V1_UY98_CR1,0,67,98_AL_.jpg",Il postino,"A simple Italian postman learns to love poetry while delivering mail to a famous poet, and then uses this to woo local beauty Beatrice."
"https://m.media-amazon.com/images/M/MV5BNzE1Njk0NmItNDhlMC00ZmFlLWI4ZTUtYTY4ZjgzNjkyMTU1XkEyXkFqcGdeQXVyMTQxNzMzNDI@._V1_UX67_CR0,0,67,98_AL_.jpg",Clerks,"A day in the lives of two convenience clerks named Dante and Randal as they annoy customers, discuss movies, and play hockey on the store roof."
"https://m.media-amazon.com/images/M/MV5BZWY0ODc2NDktYmYxNS00MGZiLTk5YjktZjgwZWFhNDQ0MzNhXkEyXkFqcGdeQXVyNTI4MjkwNjA@._V1_UX67_CR0,0,67,98_AL_.jpg",Short Cuts,The day-to-day lives of several suburban Los Angeles residents.
"https://m.media-amazon.com/images/M/MV5BNDE0MWE1ZTMtOWFkMS00YjdiLTkwZTItMDljYjY3MjM0NTk5XkEyXkFqcGdeQXVyNDYyMDk5MTU@._V1_UX67_CR0,0,67,98_AL_.jpg",Philadelphia,"When a man with HIV is fired by his law firm because of his condition, he hires a homophobic small time lawyer as the only willing advocate for a wrongful dismissal suit."
"https://m.media-amazon.com/images/M/MV5BN2Y0NWRkNWItZWEwNi00MDNlLWJmZDYtNTkwYzI5Nzg4MjVjXkEyXkFqcGdeQXVyMTMxODk2OTU@._V1_UX67_CR0,0,67,98_AL_.jpg",The Muppet Christmas Carol,The Muppet characters tell their version of the classic tale of an old and bitter miser's redemption on Christmas Eve.
"https://m.media-amazon.com/images/M/MV5BZDkzOTFmMTUtMmI2OS00MDE4LTg5YTUtODMwNDMzNmI5OGYwL2ltYWdlXkEyXkFqcGdeQXVyMTQxNzMzNDI@._V1_UY98_CR3,0,67,98_AL_.jpg",Malcolm X,"Biographical epic of the controversial and influential Black Nationalist leader, from his early life and career as a small-time gangster, to his ministry as a member of the Nation of Islam."
"https://m.media-amazon.com/images/M/MV5BZDNiYmRkNDYtOWU1NC00NmMxLWFkNmUtMGI5NTJjOTJmYTM5XkEyXkFqcGdeQXVyNzQ1ODk3MTQ@._V1_UX67_CR0,0,67,98_AL_.jpg",The Last of the Mohicans,Three trappers protect the daughters of a British Colonel in the midst of the French and Indian War.
"https://m.media-amazon.com/images/M/MV5BZjVkYmFkZWQtZmNjYy00NmFhLTliMWYtNThlOTUxNjg5ODdhXkEyXkFqcGdeQXVyMTMxODk2OTU@._V1_UY98_CR4,0,67,98_AL_.jpg",Kurenai no buta,"In 1930s Italy, a veteran World War I pilot is cursed to look like an anthropomorphic pig."
"https://m.media-amazon.com/images/M/MV5BNTYzN2MxODMtMDBhOC00Y2M0LTgzMTItMzQ4NDIyYWIwMDEzL2ltYWdlL2ltYWdlXkEyXkFqcGdeQXVyNTc1NTQxODI@._V1_UX67_CR0,0,67,98_AL_.jpg",Glengarry Glen Ross,An examination of the machinations behind the scenes at a real estate office.
"https://m.media-amazon.com/images/M/MV5BMmRlZDQ1MmUtMzE2Yi00YTkxLTk1MGMtYmIyYWQwODcxYzRlXkEyXkFqcGdeQXVyNTI4MjkwNjA@._V1_UX67_CR0,0,67,98_AL_.jpg",A Few Good Men,Military lawyer Lieutenant Daniel Kaffee defends Marines accused of murder. They contend they were acting under orders.
"https://m.media-amazon.com/images/M/MV5BOWQ1ZWE0MTQtMmEwOS00YjA3LTgyZTAtNjY5ODEyZTJjNDI2XkEyXkFqcGdeQXVyNjE5MjUyOTM@._V1_UX67_CR0,0,67,98_AL_.jpg",Fried Green Tomatoes,A housewife who is unhappy with her life befriends an old lady in a nursing home and is enthralled by the tales she tells of people she used to know.
"https://m.media-amazon.com/images/M/MV5BMTgxMDMxMTctNDY0Zi00ZmNlLWFlYmQtODA2YjY4MDk4MjU1XkEyXkFqcGdeQXVyNTc1NTQxODI@._V1_UX67_CR0,0,67,98_AL_.jpg",Barton Fink,A renowned New York playwright is enticed to California to write for the movies and discovers the hellish truth of Hollywood.
"https://m.media-amazon.com/images/M/MV5BMTY2Njk3MTAzM15BMl5BanBnXkFtZTgwMTY5Mzk4NjE@._V1_UX67_CR0,0,67,98_AL_.jpg",Miller's Crossing,"Tom Reagan, an advisor to a Prohibition-era crime boss, tries to keep the peace between warring mobs but gets caught in divided loyalties."
"https://m.media-amazon.com/images/M/MV5BMDhiOTM2OTctODk3Ny00NWI4LThhZDgtNGQ4NjRiYjFkZGQzXkEyXkFqcGdeQXVyMTA0MjU0Ng@@._V1_UX67_CR0,0,67,98_AL_.jpg",Who Framed Roger Rabbit,A toon-hating detective is a cartoon rabbit's only hope to prove his innocence when he is accused of murder.
"https://m.media-amazon.com/images/M/MV5BNDcwMTYzMjctN2M2Yy00ZDcxLWJhNTEtMGNhYzEwYzc2NDE4XkEyXkFqcGdeQXVyNTI4MjkwNjA@._V1_UY98_CR0,0,67,98_AL_.jpg",Spoorloos,"Rex and Saskia, a young couple in love, are on vacation. They stop at a busy service station and Saskia is abducted. After three years and no sign of Saskia, Rex begins receiving letters from the abductor."
"https://m.media-amazon.com/images/M/MV5BYjE3ODY5OWEtZmE0Mi00MjUxLTg5MmUtZmFkMzM1N2VjMmU5XkEyXkFqcGdeQXVyNTI4MjkwNjA@._V1_UX67_CR0,0,67,98_AL_.jpg",Withnail & I,"In 1969, two substance-abusing, unemployed actors retreat to the countryside for a holiday that proves disastrous."
"https://m.media-amazon.com/images/M/MV5BZTk0NDU4YmItOTk0ZS00ODc2LTkwNGItNWI5MDJkNTJiYWMxXkEyXkFqcGdeQXVyNjUwNzk3NDc@._V1_UX67_CR0,0,67,98_AL_.jpg",The Last Emperor,The story of the final Emperor of China.
"https://m.media-amazon.com/images/M/MV5BMmQwNzczZDItNmI0OS00MjRmLTliYWItZWIyMjk1MTU4ZTQ4L2ltYWdlXkEyXkFqcGdeQXVyNTAyODkwOQ@@._V1_UX67_CR0,0,67,98_AL_.jpg",Empire of the Sun,A young English boy struggles to survive under Japanese occupation during World War II.
"https://m.media-amazon.com/images/M/MV5BZjEyZTdhNDMtMWFkMS00ZmRjLWEyNmEtZDU3MWFkNDEzMDYwXkEyXkFqcGdeQXVyNjc1NTYyMjg@._V1_UX67_CR0,0,67,98_AL_.jpg",Der Name der Rose,An intellectually nonconformist friar investigates a series of mysterious deaths in an isolated abbey.
"https://m.media-amazon.com/images/M/MV5BMzExOTczNTgtN2Q1Yy00MmI1LWE0NjgtNmIwMzdmZGNlODU1XkEyXkFqcGdeQXVyNDkzNTM2ODg@._V1_UX67_CR0,0,67,98_AL_.jpg",Blue Velvet,"The discovery of a severed human ear found in a field leads a young man on an investigation related to a beautiful, mysterious nightclub singer and a group of psychopathic criminals who have kidnapped her child."
"https://m.media-amazon.com/images/M/MV5BY2E1YWRlNzAtYzAwYy00MDg5LTlmYTUtYjdlZDI0NzFkNjNlL2ltYWdlL2ltYWdlXkEyXkFqcGdeQXVyNjQ2MjQ5NzM@._V1_UX67_CR0,0,67,98_AL_.jpg",The Purple Rose of Cairo,"In New Jersey in 1935, a movie character walks off the screen and into the real world."
