Poster_Link,Series_Title,Overview
"https://m.media-amazon.com/images/M/MV5BMTUxMjEzMzI2MV5BMl5BanBnXkFtZTgwNTU3ODAxMDE@._V1_UX67_CR0,0,67,98_AL_.jpg",After Hours,An ordinary word processor has the worst night of his life after he agrees to visit a girl in Soho who he met that evening at a coffee shop.
"https://m.media-amazon.com/images/M/MV5BMGUwMjM0MTEtOGY2NS00MjJmLWEyMDAtYmNkMWJjOWJlNGM0XkEyXkFqcGdeQXVyMTQxNzMzNDI@._V1_UX67_CR0,0,67,98_AL_.jpg",Zelig,"""Documentary"" about a man who can look and act like whoever he's around, and meets various famous people."
"https://m.media-amazon.com/images/M/MV5BMTU5MzMwMzAzM15BMl5BanBnXkFtZTcwNjYyMjA0Mg@@._V1_UX67_CR0,0,67,98_AL_.jpg",The Verdict,A lawyer sees the chance to salvage his career and self-respect by taking a medical malpractice case to trial rather than settling.
"https://m.media-amazon.com/images/M/MV5BMzcyYWE5YmQtNDE1Yi00ZjlmLWFlZTAtMzRjODBiYjM3OTA3XkEyXkFqcGdeQXVyMTQxNzMzNDI@._V1_UX67_CR0,0,67,98_AL_.jpg",Star Trek II: The Wrath of Khan,"With the assistance of the Enterprise crew, Admiral Kirk must stop an old nemesis, Khan Noonien Singh, from using the life-generating Genesis Device as the ultimate weapon."
"https://m.media-amazon.com/images/M/MV5BODBmOWU2YWMtZGUzZi00YzRhLWJjNDAtYTUwNWVkNDcyZmU5XkEyXkFqcGdeQXVyNDk3NzU2MTQ@._V1_UX67_CR0,0,67,98_AL_.jpg",First Blood,A veteran Green Beret is forced by a cruel Sheriff and his deputies to flee into the mountains and wage an escalating one-man war against his pursuers.
"https://m.media-amazon.com/images/M/MV5BNWU3MDFkYWQtMWQ5YS00YTcwLThmNDItODY4OWE2ZTdhZmIwXkEyXkFqcGdeQXVyMjUzOTY1NTc@._V1_UX67_CR0,0,67,98_AL_.jpg",Ordinary People,"The accidental death of the older son of an affluent family deeply strains the relationships among the bitter mother, the good-natured father, and the guilt-ridden younger son."
"https://m.media-amazon.com/images/M/MV5BZjA3YjdhMWEtYjc2Ni00YzVlLWI0MTUtMGZmNTJjNmU0Yzk2XkEyXkFqcGdeQXVyNzkwMjQ5NzM@._V1_UX67_CR0,0,67,98_AL_.jpg",Airplane!,A man afraid to fly must ensure that a plane lands safely after the pilots become sick.
"https://m.media-amazon.com/images/M/MV5BYzYyNjg3OTctNzA2ZS00NjkzLWE4MmYtZDAzZWQ0NzkyMTJhXkEyXkFqcGdeQXVyMTMxODk2OTU@._V1_UX67_CR0,0,67,98_AL_.jpg",Rupan sansei: Kariosutoro no shiro,"A dashing thief, his gang of desperadoes and an intrepid policeman struggle to free a princess from an evil count's clutches, and learn the hidden secret to a fabulous treasure that she holds part of a key to."
"https://m.media-amazon.com/images/M/MV5BNzk1OGU2NmMtNTdhZC00NjdlLWE5YTMtZTQ0MGExZTQzOGQyXkEyXkFqcGdeQXVyMTQxNzMzNDI@._V1_UX67_CR0,0,67,98_AL_.jpg",Halloween,"Fifteen years after murdering his sister on Halloween night 1963, Michael Myers escapes from a mental hospital and returns to the small town of Haddonfield, Illinois to kill again."
"https://m.media-amazon.com/images/M/MV5BYmVhMDQ1YWUtYjgxOS00NzYyLWI0ZGItNTg3ZjM0MmQ4NmIwXkEyXkFqcGdeQXVyMjQzMzQzODY@._V1_UY98_CR3,0,67,98_AL_.jpg",Le locataire,A bureaucrat rents a Paris apartment where he finds himself drawn into a rabbit hole of dangerous paranoia.
"https://m.media-amazon.com/images/M/MV5BMTYxMDk1NTA5NF5BMl5BanBnXkFtZTcwNDkzNzA2NA@@._V1_UX67_CR0,0,67,98_AL_.jpg",Love and Death,"In czarist Russia, a neurotic soldier and his distant cousin formulate a plot to assassinate Napoleon."
"https://m.media-amazon.com/images/M/MV5BMjE1NDY0NDk3Ml5BMl5BanBnXkFtZTcwMTAzMTM3NA@@._V1_UX67_CR0,0,67,98_AL_.jpg",The Taking of Pelham One Two Three,"In New York, armed men hijack a subway car and demand a ransom for the passengers. Even if it's paid, how could they get away?"
"https://m.media-amazon.com/images/M/MV5BZGZmMWE1MDYtNzAyNC00MDMzLTgzZjQtNTQ5NjYzN2E4MzkzXkEyXkFqcGdeQXVyNDk3NzU2MTQ@._V1_UX67_CR0,0,67,98_AL_.jpg",Blazing Saddles,"In order to ruin a western town, a corrupt politician appoints a black Sheriff, who promptly becomes his most formidable adversary."
"https://m.media-amazon.com/images/M/MV5BYTU4ZTI0NzAtYzMwNi00YmMxLThmZWItNTY5NzgyMDAwYWVhXkEyXkFqcGdeQXVyNjUwNzk3NDc@._V1_UX67_CR0,0,67,98_AL_.jpg",Serpico,An honest New York cop named Frank Serpico blows the whistle on rampant corruption in the force only to have his comrades turn against him.
"https://m.media-amazon.com/images/M/MV5BNGZiMTkyNzQtMDdmZi00ZDNkLWE4YTAtZGNlNTIzYzQyMGM2XkEyXkFqcGdeQXVyNjc1NTYyMjg@._V1_UX67_CR0,0,67,98_AL_.jpg",Enter the Dragon,A secret agent comes to an opium lord's island fortress with other fighters for a martial-arts tournament.
"https://m.media-amazon.com/images/M/MV5BZjBhYzU3NWItOWZjMy00NjI5LWFmYmItZmIyOWFlMDIxMWNiXkEyXkFqcGdeQXVyMTQxNzMzNDI@._V1_UX67_CR0,0,67,98_AL_.jpg",Deliverance,"Intent on seeing the Cahulawassee River before it's dammed and turned into a lake, outdoor fanatic Lewis Medlock takes his friends on a canoeing trip they'll never forget into the dangerous American back-country."
"https://m.media-amazon.com/images/M/MV5BOTZhY2E3NmItMGIwNi00OTA2LThkYmEtODFiZTM0NGI0ZWU5XkEyXkFqcGdeQXVyNTc1NTQxODI@._V1_UY98_CR1,0,67,98_AL_.jpg",The French Connection,A pair of NYC cops in the Narcotics Bureau stumble onto a drug smuggling job with a French connection.
"https://m.media-amazon.com/images/M/MV5BMzdhMTM2YTItOWU2YS00MTM0LTgyNDYtMDM1OWM3NzkzNTM2XkEyXkFqcGdeQXVyNjc1NTYyMjg@._V1_UX67_CR0,0,67,98_AL_.jpg",Dirty Harry,"When a madman calling himself ""the Scorpio Killer"" menaces the city, tough-as-nails San Francisco Police Inspector ""Dirty"" Harry Callahan is assigned to track down and ferret out the crazed psychopath."
"https://m.media-amazon.com/images/M/MV5BNGE3ZWZiNzktMDIyOC00ZmVhLThjZTktZjQ5NjI4NGVhMDBlXkEyXkFqcGdeQXVyMjI4MjA5MzA@._V1_UX67_CR0,0,67,98_AL_.jpg",Where Eagles Dare,"Allied agents stage a daring raid on a castle where the Nazis are holding American brigadier general George Carnaby prisoner, but that's not all that's really going on."
"https://m.media-amazon.com/images/M/MV5BZDVhNzQxZDEtMzcyZC00ZDg1LWFkZDctOWYxZTY0ZmYzYjc2XkEyXkFqcGdeQXVyMjA0MDQ0Mjc@._V1_UX67_CR0,0,67,98_AL_.jpg",The Odd Couple,"Two friends try sharing an apartment, but their ideas of housekeeping and lifestyles are as different as night and day."
"https://m.media-amazon.com/images/M/MV5BM2Y1ZTI0NzktYzU3MS00YmE1LThkY2EtMDc0NGYxNTNlZDA5XkEyXkFqcGdeQXVyNTAyODkwOQ@@._V1_UX67_CR0,0,67,98_AL_.jpg",The Dirty Dozen,"During World War II, a rebellious U.S. Army Major is assigned a dozen convicted murderers to train and lead them into a mass assassination mission of German officers."
"https://m.media-amazon.com/images/M/MV5BZjNkNGJjYWEtM2IyNi00ZjM5LWFlYjYtYjQ4NTU5MGFlMTI2XkEyXkFqcGdeQXVyMTMxMTY0OTQ@._V1_UY98_CR3,0,67,98_AL_.jpg",Belle de jour,A frigid young housewife decides to spend her midweek afternoons as a prostitute.
"https://m.media-amazon.com/images/M/MV5BMTRjOTA1NzctNzFmMy00ZjcwLWExYjgtYWQyZDM5ZWY1Y2JlXkEyXkFqcGdeQXVyMDI2NDg0NQ@@._V1_UX67_CR0,0,67,98_AL_.jpg",A Man for All Seasons,"The story of Sir Thomas More, who stood up to King Henry VIII when the King rejected the Roman Catholic Church to obtain a divorce and remarry."
"https://m.media-amazon.com/images/M/MV5BZTU5ZThjNzAtNjc4NC00OTViLWIxYTYtODFmMTk5Y2NjZjZiL2ltYWdlL2ltYWdlXkEyXkFqcGdeQXVyNjc1NTYyMjg@._V1_UX67_CR0,0,67,98_AL_.jpg",Repulsion,A sex-repulsed woman who disapproves of her sister's boyfriend sinks into depression and has horrific visions of rape and violence.
"https://m.media-amazon.com/images/M/MV5BYzdlYmQ3MWMtMDY3My00MzVmLTg0YmMtYjRlZDUzNjBlMmE0L2ltYWdlL2ltYWdlXkEyXkFqcGdeQXVyNjc1NTYyMjg@._V1_UX67_CR0,0,67,98_AL_.jpg",Zulu,Outnumbered British soldiers do battle with Zulu warriors at Rorke's Drift.
"https://m.media-amazon.com/images/M/MV5BMTQ2MzE0OTU3NV5BMl5BanBnXkFtZTcwNjQxNTgzNA@@._V1_UX67_CR0,0,67,98_AL_.jpg",Goldfinger,"While investigating a gold magnate's smuggling, James Bond uncovers a plot to contaminate the Fort Knox gold reserve."
"https://m.media-amazon.com/images/M/MV5BMTAxNDA1ODc5MDleQTJeQWpwZ15BbWU4MDg2MDA4OTEx._V1_UX67_CR0,0,67,98_AL_.jpg",The Birds,A wealthy San Francisco socialite pursues a potential boyfriend to a small Northern California town that slowly takes a turn for the bizarre when birds of all kinds suddenly begin to attack people.
"https://m.media-amazon.com/images/M/MV5BOWNlMTJmMWUtYjk0MC00M2U4LWI1ODItZDgxNDZiODFmNjc5XkEyXkFqcGdeQXVyMTAwMzUyOTc@._V1_UX67_CR0,0,67,98_AL_.jpg",Cape Fear,A lawyer's family is stalked by a man he once helped put in jail.
"https://m.media-amazon.com/images/M/MV5BZjM3ZTAzZDYtZmFjZS00YmQ1LWJlOWEtN2I4MDRmYzY5YmRlL2ltYWdlXkEyXkFqcGdeQXVyMjgyNjk3MzE@._V1_UX67_CR0,0,67,98_AL_.jpg",Peeping Tom,"A young man murders women, using a movie camera to film their dying expressions of terror."
"https://m.media-amazon.com/images/M/MV5BMzYyNzU0MTM1OF5BMl5BanBnXkFtZTcwMzE1ODE1NA@@._V1_UX67_CR0,0,67,98_AL_.jpg",The Magnificent Seven,Seven gunfighters are hired by Mexican peasants to liberate their village from oppressive bandits.
"https://m.media-amazon.com/images/M/MV5BNzBiMWRhNzQtMjZhZS00NzFmLWE5YWMtOWY4NzIxMjYzZTEyXkEyXkFqcGdeQXVyMzg2MzE2OTE@._V1_UY98_CR3,0,67,98_AL_.jpg",Les yeux sans visage,"A surgeon causes an accident which leaves his daughter disfigured, and goes to extremes to give her a new face."
"https://m.media-amazon.com/images/M/MV5BYTExYjM3MDYtMzg4MC00MjU4LTljZjAtYzdlMTFmYTJmYTE4XkEyXkFqcGdeQXVyNTAyODkwOQ@@._V1_UX67_CR0,0,67,98_AL_.jpg",Invasion of the Body Snatchers,A small-town doctor learns that the population of his community is being replaced by emotionless alien duplicates.
"https://m.media-amazon.com/images/M/MV5BMTg2ODcxOTU1OV5BMl5BanBnXkFtZTgwNzA3ODI1MDE@._V1_UX67_CR0,0,67,98_AL_.jpg",Rebel Without a Cause,"A rebellious young man with a troubled past comes to a new town, finding friends and enemies."
"https://m.media-amazon.com/images/M/MV5BYTVlM2JmOGQtNWEwYy00NDQzLWIyZmEtOGZhMzgxZGRjZDA0XkEyXkFqcGdeQXVyMDI2NDg0NQ@@._V1_UX67_CR0,0,67,98_AL_.jpg",The Ladykillers,Five oddball criminals planning a bank robbery rent rooms on a cul-de-sac from an octogenarian widow under the pretext that they are classical musicians.
"https://m.media-amazon.com/images/M/MV5BYmFlNTA1NWItODQxNC00YjFmLWE3ZWYtMzg3YTkwYmMxMjY2XkEyXkFqcGdeQXVyMTMxMTY0OTQ@._V1_UX67_CR0,0,67,98_AL_.jpg",Sabrina,"A playboy becomes interested in the daughter of his family's chauffeur, but it's his more serious brother who would be the better man for her."
"https://m.media-amazon.com/images/M/MV5BMWM1ZDhlM2MtNDNmMi00MDk4LTg5MjgtODE4ODk1MjYxOTIwXkEyXkFqcGdeQXVyNjc0MzMzNjA@._V1_UX67_CR0,0,67,98_AL_.jpg",The Quiet Man,"A retired American boxer returns to the village of his birth in Ireland, where he falls for a spirited redhead whose brother is contemptuous of their union."
"https://m.media-amazon.com/images/M/MV5BMTU5NTBmYTAtOTgyYi00NGM0LWE0ODctZjNiYWM5MmIxYzE4XkEyXkFqcGdeQXVyNTAyODkwOQ@@._V1_UX67_CR0,0,67,98_AL_.jpg",The Day the Earth Stood Still,An alien lands and tells the people of Earth that they must live peacefully or be destroyed as a danger to other planets.
"https://m.media-amazon.com/images/M/MV5BYzM3YjE2NGMtODY3Zi00NTY0LWE4Y2EtMTE5YzNmM2U1NTg2XkEyXkFqcGdeQXVyMTY5Nzc4MDY@._V1_UX67_CR0,0,67,98_AL_.jpg",The African Queen,"In WWI Africa, a gin-swilling riverboat captain is persuaded by a strait-laced missionary to use his boat to attack an enemy warship."
"https://m.media-amazon.com/images/M/MV5BYWUxMzViZTUtNTYxNy00YjY4LWJmMjYtMzNlOThjNjhiZmZkXkEyXkFqcGdeQXVyMDI2NDg0NQ@@._V1_UX67_CR0,0,67,98_AL_.jpg",Gilda,A small-time gambler hired to work in a Buenos Aires casino discovers his employer's new wife is his former lover.
"https://m.media-amazon.com/images/M/MV5BMjAxMTI1Njk3OF5BMl5BanBnXkFtZTgwNjkzODk4NTE@._V1_UX67_CR0,0,67,98_AL_.jpg",Fantasia,"A collection of animated interpretations of great works of Western, classical music."
"https://m.media-amazon.com/images/M/MV5BYjllMmE0Y2YtYWIwZi00OWY1LWJhNWItYzM2MmNiYmFiZmRmXkEyXkFqcGdeQXVyNjc1NTYyMjg@._V1_UX67_CR0,0,67,98_AL_.jpg",The Invisible Man,"A scientist finds a way of becoming invisible, but in doing so, he becomes murderously insane."
"https://m.media-amazon.com/images/M/MV5BODQ0M2Y5M2QtZGIwMC00MzJjLThlMzYtNmE3ZTMzZTYzOGEwXkEyXkFqcGdeQXVyMTkxNjUyNQ@@._V1_UX67_CR0,0,67,98_AL_.jpg",Dark Waters,A corporate defense attorney takes on an environmental lawsuit against a chemical company that exposes a lengthy history of pollution.
"https://m.media-amazon.com/images/M/MV5BMjIwOTA3NDI3MF5BMl5BanBnXkFtZTgwNzIzMzA5NTM@._V1_UX67_CR0,0,67,98_AL_.jpg",Searching,"After his teenage daughter goes missing, a desperate father tries to find clues on her laptop."
"https://m.media-amazon.com/images/M/MV5BOTg4ZTNkZmUtMzNlZi00YmFjLTk1MmUtNWQwNTM0YjcyNTNkXkEyXkFqcGdeQXVyNjg2NjQwMDQ@._V1_UX67_CR0,0,67,98_AL_.jpg",Once Upon a Time... in Hollywood,A faded television actor and his stunt double strive to achieve fame and success in the final years of Hollywood's Golden Age in 1969 Los Angeles.
"https://m.media-amazon.com/images/M/MV5BNzk2NmU3NmEtMTVhNS00NzJhLWE1M2ItMThjZjI5NWM3YmFmXkEyXkFqcGdeQXVyMjA1MzUyODk@._V1_UY98_CR1,0,67,98_AL_.jpg",Nelyubov,A couple going through a divorce must team up to find their son who has disappeared during one of their bitter arguments.
"https://m.media-amazon.com/images/M/MV5BMjg4ZmY1MmItMjFjOS00ZTg2LWJjNDYtNDM2YmM2NzhiNmZhXkEyXkFqcGdeQXVyNTAzMTY4MDA@._V1_UX67_CR0,0,67,98_AL_.jpg",The Florida Project,"Set over one summer, the film follows precocious six-year-old Moonee as she courts mischief and adventure with her ragtag playmates and bonds with her rebellious but caring mother, all while living in the shadows of Walt Disney World."
"https://m.media-amazon.com/images/M/MV5BYmM4YzA5NjUtZGEyOS00YzllLWJmM2UtZjhhNmJhM2E1NjUxXkEyXkFqcGdeQXVyMTkxNjUyNQ@@._V1_UX67_CR0,0,67,98_AL_.jpg",Just Mercy,World-renowned civil rights defense attorney Bryan Stevenson works to free a wrongly condemned death row prisoner.
"https://m.media-amazon.com/images/M/MV5BMjQ2NDU3NDE0M15BMl5BanBnXkFtZTgwMjA3OTg0MDI@._V1_UX67_CR0,0,67,98_AL_.jpg",Gifted,"Frank, a single man raising his child prodigy niece Mary, is drawn into a custody battle with his mother."
"https://m.media-amazon.com/images/M/MV5BOWVmZGQ0MGYtMDI1Yy00MDkxLWJiYjQtMmZjZmQ0NDFmMDRhXkEyXkFqcGdeQXVyNjg3MDMxNzU@._V1_UX67_CR0,0,67,98_AL_.jpg",The Peanut Butter Falcon,Zak runs away from his care home to make his dream of becoming a wrestler come true.
"https://m.media-amazon.com/images/M/MV5BMTc5NzQzNjk2NF5BMl5BanBnXkFtZTgwODU0MjI5NjE@._V1_UY98_CR0,0,67,98_AL_.jpg",Victoria,A young Spanish woman who has recently moved to Berlin finds her flirtation with a local guy turn potentially deadly as their night out with his friends reveals a dangerous secret.
"https://m.media-amazon.com/images/M/MV5BMTkwODUzODA0OV5BMl5BanBnXkFtZTgwMTA3ODkxNzE@._V1_UY98_CR0,0,67,98_AL_.jpg",Mustang,"When five orphan girls are seen innocently playing with boys on a beach, their scandalized conservative guardians confine them while forced marriages are arranged."
"https://m.media-amazon.com/images/M/MV5BNjM0NTc0NzItM2FlYS00YzEwLWE0YmUtNTA2ZWIzODc2OTgxXkEyXkFqcGdeQXVyNTgwNzIyNzg@._V1_UX67_CR0,0,67,98_AL_.jpg",Guardians of the Galaxy Vol. 2,"The Guardians struggle to keep together as a team while dealing with their personal family issues, notably Star-Lord's encounter with his father the ambitious celestial being Ego."
"https://m.media-amazon.com/images/M/MV5BMjM3MjQ1MzkxNl5BMl5BanBnXkFtZTgwODk1ODgyMjI@._V1_UX67_CR0,0,67,98_AL_.jpg",Baby Driver,"After being coerced into working for a crime boss, a young getaway driver finds himself taking part in a heist doomed to fail."
"https://m.media-amazon.com/images/M/MV5BYWFlOWI3YTMtYTk3NS00YWQ2LTlmYTMtZjk0ZDk4Y2NjODI0XkEyXkFqcGdeQXVyNTQxNTQ4Mg@@._V1_UX67_CR0,0,67,98_AL_.jpg",Only the Brave,"Based on the true story of the Granite Mountain Hotshots, a group of elite firefighters who risk everything to protect a town from a historic wildfire."
"https://m.media-amazon.com/images/M/MV5BMjIxOTI0MjU5NV5BMl5BanBnXkFtZTgwNzM4OTk4NTE@._V1_UX67_CR0,0,67,98_AL_.jpg",Bridge of Spies,"During the Cold War, an American lawyer is recruited to defend an arrested Soviet spy in court, and then help the CIA facilitate an exchange of the spy for the Soviet captured American U2 spy plane pilot, Francis Gary Powers."
"https://m.media-amazon.com/images/M/MV5BMTEzNzY0OTg0NTdeQTJeQWpwZ15BbWU4MDU3OTg3MjUz._V1_UX67_CR0,0,67,98_AL_.jpg",Incredibles 2,The Incredibles family takes on a new mission which involves a change in family roles: Bob Parr (Mr. Incredible) must manage the house while his wife Helen (Elastigirl) goes out to save the world.
"https://m.media-amazon.com/images/M/MV5BMjI4MzU5NTExNF5BMl5BanBnXkFtZTgwNzY1MTEwMDI@._V1_UX67_CR0,0,67,98_AL_.jpg",Moana,"In Ancient Polynesia, when a terrible curse incurred by the Demigod Maui reaches Moana's island, she answers the Ocean's call to seek out the Demigod to set things right."
"https://m.media-amazon.com/images/M/MV5BMjA5NjM3NTk1M15BMl5BanBnXkFtZTgwMzg1MzU2NjE@._V1_UX67_CR0,0,67,98_AL_.jpg",Sicario,An idealistic FBI agent is enlisted by a government task force to aid in the escalating war against drugs at the border area between the U.S. and Mexico.
"https://m.media-amazon.com/images/M/MV5BNmZkYjQzY2QtNjdkNC00YjkzLTk5NjUtY2MyNDNiYTBhN2M2XkEyXkFqcGdeQXVyMjMwNDgzNjc@._V1_UX67_CR0,0,67,98_AL_.jpg",Creed,"The former World Heavyweight Champion Rocky Balboa serves as a trainer and mentor to Adonis Johnson, the son of his late friend and former rival Apollo Creed."
"https://m.media-amazon.com/images/M/MV5BYTYxZjQ2YTktNmVkMC00ZTY4LThkZmItMDc4MTJiYjVhZjM0L2ltYWdlXkEyXkFqcGdeQXVyMjgyNjk3MzE@._V1_UY98_CR1,0,67,98_AL_.jpg",Leviafan,"In a Russian coastal town, Kolya is forced to fight the corrupt mayor when he is told that his house will be demolished. He recruits a lawyer friend to help, but the man's arrival brings further misfortune for Kolya and his family."
"https://m.media-amazon.com/images/M/MV5BMTg4NDA1OTA5NF5BMl5BanBnXkFtZTgwMDQ2MDM5ODE@._V1_UX67_CR0,0,67,98_AL_.jpg",Hell or High Water,A divorced father and his ex-con older brother resort to a desperate scheme in order to save their family's ranch in West Texas.
"https://m.media-amazon.com/images/M/MV5BMjA5ODgyNzcxMV5BMl5BanBnXkFtZTgwMzkzOTYzMDE@._V1_UX67_CR0,0,67,98_AL_.jpg",Philomena,"A world-weary political journalist picks up the story of a woman's search for her son, who was taken away from her decades ago after she became pregnant and was forced to live in a convent."
"https://m.media-amazon.com/images/M/MV5BMTgwODk3NDc1N15BMl5BanBnXkFtZTgwNTc1NjQwMjE@._V1_UX67_CR0,0,67,98_AL_.jpg",Dawn of the Planet of the Apes,A growing nation of genetically evolved apes led by Caesar is threatened by a band of human survivors of the devastating virus unleashed a decade earlier.
"https://m.media-amazon.com/images/M/MV5BNGMxZjFkN2EtMDRiMS00ZTBjLWI0M2MtZWUyYjFhZGViZDJlXkEyXkFqcGdeQXVyMTMxODk2OTU@._V1_UX67_CR0,0,67,98_AL_.jpg",El cuerpo,A detective searches for the body of a femme fatale which has gone missing from a morgue.
"https://m.media-amazon.com/images/M/MV5BZGIxODNjM2YtZjA5Mi00MjA5LTk2YjItODE0OWI5NThjNTBmXkEyXkFqcGdeQXVyNzQ1ODk3MTQ@._V1_UX67_CR0,0,67,98_AL_.jpg",Serbuan maut,A S.W.A.T. team becomes trapped in a tenement run by a ruthless mobster and his army of killers and thugs.
"https://m.media-amazon.com/images/M/MV5BMjMxNjU0ODU5Ml5BMl5BanBnXkFtZTcwNjI4MzAyOA@@._V1_UX67_CR0,0,67,98_AL_.jpg",End of Watch,"Shot documentary-style, this film follows the daily grind of two young police officers in LA who are partners and friends, and what happens when they meet criminal forces greater than themselves."
"https://m.media-amazon.com/images/M/MV5BZDY3ZGI0ZDAtMThlNy00MzAxLTg4YjAtNjkwYTkxNmQ4MjdlXkEyXkFqcGdeQXVyMTMxODk2OTU@._V1_UX67_CR0,0,67,98_AL_.jpg",Kari-gurashi no Arietti,"The Clock family are four-inch-tall people who live anonymously in another family's residence, borrowing simple items to make their home. Life changes for the Clocks when their teenage daughter, Arrietty, is discovered."
"https://m.media-amazon.com/images/M/MV5BNmE5ZmE3OGItNTdlNC00YmMxLWEzNjctYzAwOGQ5ODg0OTI0XkEyXkFqcGdeQXVyMTMxODk2OTU@._V1_UX67_CR0,0,67,98_AL_.jpg",A Star Is Born,A musician helps a young singer find fame as age and alcoholism send his own career into a downward spiral.
"https://m.media-amazon.com/images/M/MV5BODhkZDIzNjgtOTA5ZS00MmMzLWFkNjYtM2Y2MzFjN2FkNjAzL2ltYWdlXkEyXkFqcGdeQXVyNTAyODkwOQ@@._V1_UY98_CR1,0,67,98_AL_.jpg",True Grit,A stubborn teenager enlists the help of a tough U.S. Marshal to track down her father's murderer.
"https://m.media-amazon.com/images/M/MV5BNDY2OTE5MzE0Nl5BMl5BanBnXkFtZTcwNDAyOTc2NA@@._V1_UX67_CR0,0,67,98_AL_.jpg",Hævnen,"The lives of two Danish families cross each other, and an extraordinary but risky friendship comes into bud. But loneliness, frailty and sorrow lie in wait."
"https://m.media-amazon.com/images/M/MV5BMTY3NjY0MTQ0Nl5BMl5BanBnXkFtZTcwMzQ2MTc0Mw@@._V1_UX67_CR0,0,67,98_AL_.jpg",Despicable Me,"When a criminal mastermind uses a trio of orphan girls as pawns for a grand scheme, he finds their love is profoundly changing him for the better."
"https://m.media-amazon.com/images/M/MV5BNjg3ODQyNTIyN15BMl5BanBnXkFtZTcwMjUzNzM5NQ@@._V1_UX67_CR0,0,67,98_AL_.jpg",50/50,"Inspired by a true story, a comedy centered on a 27-year-old guy who learns of his cancer diagnosis and his subsequent struggle to beat the disease."
"https://m.media-amazon.com/images/M/MV5BMTMzNzEzMDYxM15BMl5BanBnXkFtZTcwMTc0NTMxMw@@._V1_UX67_CR0,0,67,98_AL_.jpg",Kick-Ass,"Dave Lizewski is an unnoticed high school student and comic book fan who one day decides to become a superhero, even though he has no powers, training or meaningful reason to do so."
"https://m.media-amazon.com/images/M/MV5BMjI2ODE4ODAtMDA3MS00ODNkLTg4N2EtOGU0YjZmNGY4NjZlXkEyXkFqcGdeQXVyMTY5MDE5NA@@._V1_UY98_CR0,0,67,98_AL_.jpg",Celda 211,"The story of two men on different sides of a prison riot -- the inmate leading the rebellion and the young guard trapped in the revolt, who poses as a prisoner in a desperate attempt to survive the ordeal."
"https://m.media-amazon.com/images/M/MV5BMjAxOTU3Mzc1M15BMl5BanBnXkFtZTcwMzk1ODUzNg@@._V1_UX67_CR0,0,67,98_AL_.jpg",Moneyball,Oakland A's general manager Billy Beane's successful attempt to assemble a baseball team on a lean budget by employing computer-generated analysis to acquire new players.
"https://m.media-amazon.com/images/M/MV5BYmFmNjY5NDYtZjlhNi00YjQ5LTgzNzctNWRiNWUzNmIyNjc4XkEyXkFqcGdeQXVyMTMxODk2OTU@._V1_UY98_CR0,0,67,98_AL_.jpg",La piel que habito,"A brilliant plastic surgeon, haunted by past tragedies, creates a type of synthetic skin that withstands any kind of damage. His guinea pig: a mysterious and volatile woman who holds the key to his obsession."
"https://m.media-amazon.com/images/M/MV5BMTU5MDg0NTQ1N15BMl5BanBnXkFtZTcwMjA4Mjg3Mg@@._V1_UY98_CR1,0,67,98_AL_.jpg",Zombieland,"A shy student trying to reach his family in Ohio, a gun-toting tough guy trying to find the last Twinkie, and a pair of sisters trying to get to an amusement park join forces to travel across a zombie-filled America."
"https://m.media-amazon.com/images/M/MV5BMzc0ZmUyZjAtZThkMi00ZDY5LTg5YjctYmUwM2FiYjMyMDI5XkEyXkFqcGdeQXVyMTMxODk2OTU@._V1_UX67_CR0,0,67,98_AL_.jpg",Die Welle,A high school teacher's experiment to demonstrate to his students what life is like under a dictatorship spins horribly out of control when he forms a social unit with a life of its own.
"https://m.media-amazon.com/images/M/MV5BMTg0NjEwNjUxM15BMl5BanBnXkFtZTcwMzk0MjQ5Mg@@._V1_UX67_CR0,0,67,98_AL_.jpg",Sherlock Holmes,Detective Sherlock Holmes and his stalwart partner Watson engage in a battle of wits and brawn with a nemesis whose plot is a threat to all of England.
"https://m.media-amazon.com/images/M/MV5BMjEzOTE3ODM3OF5BMl5BanBnXkFtZTcwMzYyODI4Mg@@._V1_UX67_CR0,0,67,98_AL_.jpg",The Blind Side,"The story of Michael Oher, a homeless and traumatized boy who became an All-American football player and first-round NFL draft pick with the help of a caring woman and her family."
"https://m.media-amazon.com/images/M/MV5BMTIzNTg3NzkzNV5BMl5BanBnXkFtZTcwNzMwMjU2MQ@@._V1_UX67_CR0,0,67,98_AL_.jpg",The Visitor,A college professor travels to New York City to attend a conference and finds a young couple living in his apartment.
"https://m.media-amazon.com/images/M/MV5BMTU0NzY0MTY5OF5BMl5BanBnXkFtZTcwODY3MDEwMg@@._V1_UY98_CR3,0,67,98_AL_.jpg",Seven Pounds,A man with a fateful secret embarks on an extraordinary journey of redemption by forever changing the lives of seven strangers.
"https://m.media-amazon.com/images/M/MV5BMTcwMzU0OTY3NF5BMl5BanBnXkFtZTYwNzkwNjg2._V1_UX67_CR0,0,67,98_AL_.jpg",Eastern Promises,A teenager who dies during childbirth leaves clues in her journal that could tie her child to a rape involving a violent Russian mob family.
"https://m.media-amazon.com/images/M/MV5BMjkyMTE1OTYwNF5BMl5BanBnXkFtZTcwMDIxODYzMw@@._V1_UX67_CR0,0,67,98_AL_.jpg",Stardust,"In a countryside town bordering on a magical land, a young man makes a promise to his beloved that he'll retrieve a fallen star by venturing into the magical realm."
"https://m.media-amazon.com/images/M/MV5BMjEzMjEzNTIzOF5BMl5BanBnXkFtZTcwMTg2MjAyMw@@._V1_UY98_CR0,0,67,98_AL_.jpg",The Secret of Kells,"A young boy in a remote medieval outpost under siege from barbarian raids is beckoned to adventure when a celebrated master illuminator arrives with an ancient book, brimming with secret wisdom and powers."
"https://m.media-amazon.com/images/M/MV5BYjc4MjA2ZDgtOGY3YS00NDYzLTlmNTEtYWMxMzcwZjgzYWNjXkEyXkFqcGdeQXVyMTQxNzMzNDI@._V1_UX67_CR0,0,67,98_AL_.jpg",Inside Man,"A police detective, a bank robber, and a high-power broker enter high-stakes negotiations after the criminal's brilliant heist spirals into a hostage situation."
"https://m.media-amazon.com/images/M/MV5BYmM2NDNiNGItMTRhMi00ZDA2LTgzOWMtZTE2ZjFhMDQ2M2U5XkEyXkFqcGdeQXVyNTAyODkwOQ@@._V1_UX67_CR0,0,67,98_AL_.jpg",Gone Baby Gone,"Two Boston area detectives investigate a little girl's kidnapping, which ultimately turns into a crisis both professionally and personally."
